,title,year,certificate,time,genre,rating,metascore,simple_desc,directors,stars,votes,gross
220,Kick-Ass,(2010),R,117 min,"Action, Comedy, Crime",7.6,66        ,"Dave Lizewski is an unnoticed high school student and comic book fan who one day decides to become a superhero, even though he has no powers, training or meaningful reason to do so.",['Matthew Vaughn'],"['Aaron Taylor-Johnson', 'Nicolas Cage', 'Chloë Grace Moretz', 'Garrett M. Brown']","575,553",$48.07M
221,Falling Down,(1993),R,113 min,"Action, Crime, Drama",7.6,56        ,An ordinary man frustrated with the various flaws he sees in society begins to psychotically and violently lash out against them.,['Joel Schumacher'],"['Michael Douglas', 'Robert Duvall', 'Barbara Hershey', 'Rachel Ticotin']","197,097",$40.90M
222,Minority Report,(2002),PG-13,145 min,"Action, Crime, Mystery",7.6,80        ,"In a future where a special police unit is able to arrest murderers before they commit their crimes, an officer from that unit is himself accused of a future murder.",['Steven Spielberg'],"['Tom Cruise', 'Colin Farrell', 'Samantha Morton', 'Max von Sydow']","565,624",$132.07M
223,Sherlock Holmes,(2009),PG-13,128 min,"Action, Adventure, Mystery",7.6,57        ,Detective Sherlock Holmes and his stalwart partner Watson engage in a battle of wits and brawn with a nemesis whose plot is a threat to all of England.,['Guy Ritchie'],"['Robert Downey Jr.', 'Jude Law', 'Rachel McAdams', 'Mark Strong']","648,677",$209.03M
224,Lethal Weapon,(1987),R,109 min,"Action, Crime, Thriller",7.6,68        ,Two newly paired cops who are complete opposites must put aside their differences in order to catch a gang of drug smugglers.,['Richard Donner'],"['Mel Gibson', 'Danny Glover', 'Gary Busey', 'Mitchell Ryan']","266,582",$65.21M
225,Rise of the Planet of the Apes,(2011),PG-13,105 min,"Action, Drama, Sci-Fi",7.6,68        ,A substance designed to help the brain repair itself gives advanced intelligence to a chimpanzee who leads an ape uprising.,['Rupert Wyatt'],"['James Franco', 'Andy Serkis', 'Freida Pinto', 'Karin Konoval']","540,667",$176.76M
226,Battle Royale,(2000),Not Rated,114 min,"Action, Adventure, Drama",7.6,81        ,"In the future, the Japanese government captures a class of ninth-grade students and forces them to kill each other under the revolutionary ""Battle Royale"" act.",['Kinji Fukasaku'],"['Tatsuya Fujiwara', 'Aki Maeda', 'Tarô Yamamoto', 'Chiaki Kuriyama']","188,474",-
227,Dawn of the Planet of the Apes,(2014),PG-13,130 min,"Action, Adventure, Drama",7.6,79        ,The fragile peace between apes and humans is threatened as mistrust and betrayal threaten to plunge both tribes into a war for dominance over the Earth.,['Matt Reeves'],"['Gary Oldman', 'Keri Russell', 'Andy Serkis', 'Kodi Smit-McPhee']","452,040",$208.55M
228,The Raid: Redemption,(2011),R,101 min,"Action, Crime, Thriller",7.6,73        ,A S.W.A.T. team becomes trapped in a tenement run by a ruthless mobster and his army of killers and thugs.,['Gareth Evans'],"['Iko Uwais', 'Ananda George', 'Ray Sahetapy', 'Donny Alamsyah']","210,370",$4.11M
229,End of Watch,(2012),R,109 min,"Action, Adventure, Crime",7.6,68        ,"Shot documentary-style, this film follows the daily grind of two young police officers in LA who are partners and friends and what happens when they meet criminal forces greater than themselves.",['David Ayer'],"['Jake Gyllenhaal', 'Michael Peña', 'Anna Kendrick', 'America Ferrera']","256,945",$41.00M
230,Enter the Dragon,(1973),R,102 min,"Action, Crime, Drama",7.6,83        ,A Shaolin martial artist travels to an island fortress to spy on an opium lord - who is also a former monk from his temple - under the guise of attending a fighting tournament.,['Robert Clouse'],"['Bruce Lee', 'John Saxon', 'Jim Kelly', 'Ahna Capri']","107,853",$25.00M
231,Die Hard with a Vengeance,(1995),R,128 min,"Action, Adventure, Thriller",7.6,58        ,"John McClane and a Harlem store owner are targeted by German terrorist Simon in New York City, where he plans to rob the Federal Reserve Building.",['John McTiernan'],"['Bruce Willis', 'Jeremy Irons', 'Samuel L. Jackson', 'Graham Greene']","396,154",$100.01M
232,Hotel Mumbai,(2018),R,123 min,"Action, Drama, History",7.6,62        ,The true story of the Taj Hotel terrorist attack in Mumbai. Hotel staff risk their lives to keep everyone safe as people make unthinkable sacrifices to protect themselves and their families.,['Anthony Maras'],"['Dev Patel', 'Armie Hammer', 'Nazanin Boniadi', 'Anupam Kher']","67,090",$9.65M
233,Only the Brave,(2017),PG-13,134 min,"Action, Biography, Drama",7.6,72        ,"Based on the true story of the Granite Mountain Hotshots, a group of elite firefighters who risk everything to protect a town from a historic wildfire.",['Joseph Kosinski'],"['Josh Brolin', 'Miles Teller', 'Jeff Bridges', 'Jennifer Connelly']","73,165",$18.34M
234,Escape from Alcatraz,(1979),PG,112 min,"Action, Biography, Crime",7.6,76        ,"Alcatraz is the most secure prison of its time. It is believed that no one can ever escape from it, until three daring men make a possibly successful attempt at escaping from one of the most infamous prisons in the world.",['Don Siegel'],"['Clint Eastwood', 'Patrick McGoohan', 'Roberts Blossom', 'Jack Thibeau']","141,870",$43.00M
235,Star Trek: First Contact,(1996),PG-13,111 min,"Action, Adventure, Drama",7.6,71        ,The Borg travel back in time intent on preventing Earth's first contact with an alien species. Captain Picard and his crew pursue them to ensure that Zefram Cochrane makes his maiden flight reaching warp speed.,['Jonathan Frakes'],"['Patrick Stewart', 'Jonathan Frakes', 'Brent Spiner', 'LeVar Burton']","128,887",$92.00M
236,United 93,(2006),R,111 min,"Action, Drama, History",7.6,90        ,"A real-time account of the events on United Flight 93, one of the planes hijacked on September 11th, 2001 that crashed near Shanksville, Pennsylvania when passengers foiled the terrorist plot.",['Paul Greengrass'],"['David Alan Basche', 'Olivia Thirlby', 'Liza Colón-Zayas', 'J.J. Johnson']","108,437",$31.57M
237,The Taking of Pelham One Two Three,(1974),R,104 min,"Action, Crime, Thriller",7.6,68        ,"Four armed men hijack a New York City subway car and demand a ransom for the passengers. The city's police are faced with a conundrum: Even if it's paid, how could they get away?",['Joseph Sargent'],"['Walter Matthau', 'Robert Shaw', 'Martin Balsam', 'Hector Elizondo']","32,977",$2.49M
238,Vampire Hunter D: Bloodlust,(2000),R,103 min,"Animation, Action, Drama",7.6,62        ,"A legendary dhampir competes with a motley family of bounty hunters to return a young woman, who has been seemingly abducted by a vampire, to her family.","['Jack Fletcher', 'Yoshiaki Kawajiri']","['Andrew Philpot', 'John Rafter Lee', 'Pamela Adlon', 'Wendee Lee']","33,523",$0.15M
