,title,year,certificate,time,genre,rating,metascore,simple_desc,directors,stars,votes,gross
0,Spider-Man: Across the Spider-Verse,(2023),PG,140 min,"Animation, Action, Adventure",9.1,86        ,"Miles Morales catapults across the Multiverse, where he encounters a team of Spider-People charged with protecting its very existence. When the heroes clash on how to handle a new threat, Miles must redefine what it means to be a hero.","['Joaquim Dos Santos', 'Kemp Powers', 'Justin K. Thompson']","['Shameik Moore', 'Hailee Steinfeld', 'Brian Tyree Henry', 'Luna Lauren Velez']","79,742",-
1,The Dark Knight,(2008),PG-13,152 min,"Action, Crime, Drama",9.0,84        ,"When the menace known as the Joker wreaks havoc and chaos on the people of Gotham, Batman must accept one of the greatest psychological and physical tests of his ability to fight injustice.",['Christopher Nolan'],"['Christian Bale', 'Heath Ledger', 'Aaron Eckhart', 'Michael Caine']","2,721,730",$534.86M
2,The Lord of the Rings: The Return of the King,(2003),PG-13,201 min,"Action, Adventure, Drama",9.0,94        ,Gandalf and Aragorn lead the World of Men against Sauron's army to draw his gaze from Frodo and Sam as they approach Mount Doom with the One Ring.,['Peter Jackson'],"['Elijah Wood', 'Viggo Mortensen', 'Ian McKellen', 'Orlando Bloom']","1,889,031",$377.85M
3,Inception,(2010),PG-13,148 min,"Action, Adventure, Sci-Fi",8.8,74        ,"A thief who steals corporate secrets through the use of dream-sharing technology is given the inverse task of planting an idea into the mind of a C.E.O., but his tragic past may doom the project and his team to disaster.",['Christopher Nolan'],"['Leonardo DiCaprio', 'Joseph Gordon-Levitt', 'Elliot Page', 'Ken Watanabe']","2,415,873",$292.58M
4,The Lord of the Rings: The Fellowship of the Ring,(2001),PG-13,178 min,"Action, Adventure, Drama",8.8,92        ,A meek Hobbit from the Shire and eight companions set out on a journey to destroy the powerful One Ring and save Middle-earth from the Dark Lord Sauron.,['Peter Jackson'],"['Elijah Wood', 'Ian McKellen', 'Orlando Bloom', 'Sean Bean']","1,917,638",$315.54M
5,The Lord of the Rings: The Two Towers,(2002),PG-13,179 min,"Action, Adventure, Drama",8.8,87        ,"While Frodo and Sam edge closer to Mordor with the help of the shifty Gollum, the divided fellowship makes a stand against Sauron's new ally, Saruman, and his hordes of Isengard.",['Peter Jackson'],"['Elijah Wood', 'Ian McKellen', 'Viggo Mortensen', 'Orlando Bloom']","1,704,961",$342.55M
6,The Matrix,(1999),R,136 min,"Action, Sci-Fi",8.7,73        ,"When a beautiful stranger leads computer hacker Neo to a forbidding underworld, he discovers the shocking truth--the life he knows is the elaborate deception of an evil cyber-intelligence.","['Lana Wachowski', 'Lilly Wachowski']","['Keanu Reeves', 'Laurence Fishburne', 'Carrie-Anne Moss', 'Hugo Weaving']","1,960,015",$171.48M
7,Star Wars: Episode V - The Empire Strikes Back,(1980),PG,124 min,"Action, Adventure, Fantasy",8.7,82        ,"After the Rebels are overpowered by the Empire, Luke Skywalker begins his Jedi training with Yoda, while his friends are pursued across the galaxy by Darth Vader and bounty hunter Boba Fett.",['Irvin Kershner'],"['Mark Hamill', 'Harrison Ford', 'Carrie Fisher', 'Billy Dee Williams']","1,322,541",$290.48M
8,Soorarai Pottru,(2020),TV-MA,153 min,"Action, Drama",8.7,-,"Nedumaaran Rajangam ""Maara"" sets out to make the common man fly and in the process takes on the world's most capital intensive industry and several enemies who stand in his way.",['Sudha Kongara'],"['Suriya', 'Paresh Rawal', 'Urvashi', 'Aparna Balamurali']","119,568",-
9,Star Wars: Episode IV - A New Hope,(1977),PG,121 min,"Action, Adventure, Fantasy",8.6,90        ,"Luke Skywalker joins forces with a Jedi Knight, a cocky pilot, a Wookiee and two droids to save the galaxy from the Empire's world-destroying battle station, while also attempting to rescue Princess Leia from the mysterious Darth Vader.",['George Lucas'],"['Mark Hamill', 'Harrison Ford', 'Carrie Fisher', 'Alec Guinness']","1,394,967",$322.74M
10,Terminator 2: Judgment Day,(1991),R,137 min,"Action, Sci-Fi",8.6,75        ,"A cyborg, identical to the one who failed to kill Sarah Connor, must now protect her 10-year old son John from an even more advanced and powerful cyborg.",['James Cameron'],"['Arnold Schwarzenegger', 'Linda Hamilton', 'Edward Furlong', 'Robert Patrick']","1,124,180",$204.84M
11,Seven Samurai,(1954),Not Rated,207 min,"Action, Drama",8.6,98        ,"Farmers from a village exploited by bandits hire a veteran samurai for protection, who gathers six other samurai to join him.",['Akira Kurosawa'],"['Toshirô Mifune', 'Takashi Shimura', 'Keiko Tsushima', 'Yukiko Shimazaki']","353,126",$0.27M
12,Harakiri,(1962),Not Rated,133 min,"Action, Drama, Mystery",8.6,85        ,"When a ronin requesting seppuku at a feudal lord's palace is told of the brutal suicide of another ronin who previously visited, he reveals how their pasts are intertwined - and in doing so challenges the clan's integrity.",['Masaki Kobayashi'],"['Tatsuya Nakadai', 'Akira Ishihama', 'Shima Iwashita', 'Tetsurô Tanba']","61,125",-
13,Léon: The Professional,(1994),R,110 min,"Action, Crime, Drama",8.5,64        ,"12-year-old Mathilda is reluctantly taken in by Léon, a professional assassin, after her family is murdered. An unusual relationship forms as she becomes his protégée and learns the assassin's trade.",['Luc Besson'],"['Jean Reno', 'Gary Oldman', 'Natalie Portman', 'Danny Aiello']","1,190,642",$19.50M
14,Gladiator,(2000),R,155 min,"Action, Adventure, Drama",8.5,67        ,A former Roman General sets out to exact vengeance against the corrupt emperor who murdered his family and sent him into slavery.,['Ridley Scott'],"['Russell Crowe', 'Joaquin Phoenix', 'Connie Nielsen', 'Oliver Reed']","1,537,673",$187.71M
15,Spider-Man: Into the Spider-Verse,(2018),PG,117 min,"Animation, Action, Adventure",8.4,87        ,Teen Miles Morales becomes the Spider-Man of his universe and must join with five spider-powered individuals from other dimensions to stop a threat for all realities.,"['Bob Persichetti', 'Peter Ramsey', 'Rodney Rothman']","['Shameik Moore', 'Jake Johnson', 'Hailee Steinfeld', 'Mahershala Ali']","576,933",$190.24M
16,Indiana Jones and the Raiders of the Lost Ark,(1981),PG,115 min,"Action, Adventure",8.4,85        ,"In 1936, archaeologist and adventurer Indiana Jones is hired by the U.S. government to find the Ark of the Covenant before the Nazis can obtain its awesome powers.",['Steven Spielberg'],"['Harrison Ford', 'Karen Allen', 'Paul Freeman', 'John Rhys-Davies']","987,995",$248.16M
17,Avengers: Endgame,(2019),PG-13,181 min,"Action, Adventure, Drama",8.4,78        ,"After the devastating events of Avengers: Infinity War (2018), the universe is in ruins. With the help of remaining allies, the Avengers assemble once more in order to reverse Thanos' actions and restore balance to the universe.","['Anthony Russo', 'Joe Russo']","['Robert Downey Jr.', 'Chris Evans', 'Mark Ruffalo', 'Chris Hemsworth']","1,182,418",$858.37M
18,Avengers: Infinity War,(2018),PG-13,149 min,"Action, Adventure, Sci-Fi",8.4,68        ,The Avengers and their allies must be willing to sacrifice all in an attempt to defeat the powerful Thanos before his blitz of devastation and ruin puts an end to the universe.,"['Anthony Russo', 'Joe Russo']","['Robert Downey Jr.', 'Chris Hemsworth', 'Mark Ruffalo', 'Chris Evans']","1,125,648",$678.82M
19,Oldboy,(2003),R,120 min,"Action, Drama, Mystery",8.4,77        ,"After being kidnapped and imprisoned for fifteen years, Oh Dae-Su is released, only to find that he must find his captor in five days.",['Park Chan-wook'],"['Choi Min-sik', 'Yoo Ji-tae', 'Kang Hye-jeong', 'Kim Byeong-Ok']","597,107",$0.71M
20,The Dark Knight Rises,(2012),PG-13,164 min,"Action, Drama, Thriller",8.4,78        ,"Eight years after the Joker's reign of chaos, Batman is coerced out of exile with the assistance of the mysterious Selina Kyle in order to defend Gotham City from the vicious guerrilla terrorist Bane.",['Christopher Nolan'],"['Christian Bale', 'Tom Hardy', 'Anne Hathaway', 'Gary Oldman']","1,743,442",$448.14M
21,Aliens,(1986),R,137 min,"Action, Adventure, Sci-Fi",8.4,84        ,"Decades after surviving the Nostromo incident, Ellen Ripley is sent out to re-establish contact with a terraforming colony but finds herself battling the Alien Queen and her offspring.",['James Cameron'],"['Sigourney Weaver', 'Michael Biehn', 'Carrie Henn', 'Paul Reiser']","733,121",$85.16M
22,Kaithi,(2019),Not Rated,145 min,"Action, Adventure, Crime",8.4,-,"Dilli, an ex-convict, endeavours to meet his daughter for the first time after leaving prison. However, his attempts are interrupted due to a drug raid planned by Inspector Bejoy.",['Lokesh Kanagaraj'],"['Karthi', 'Narain', 'Arjun Das', 'George Maryan']","36,195",-
23,Asuran,(2019),Not Rated,141 min,"Action, Drama",8.4,-,"The teenage son of a farmer from an underprivileged caste kills a rich, upper caste landlord. Will the farmer, a loving father and a pacifist by heart, be able to save his hot-blooded son is the rest of the story.",['Vetrimaaran'],"['Dhanush', 'Manju Warrier', 'Prakash Raj', 'Pasupathy']","31,235",-
24,Black Friday,(2004),Not Rated,143 min,"Action, Crime, Drama",8.4,76        ,"A film about the investigations following the 1993 serial Bombay bomb blasts, told through the different stories of the people involved --police, conspirators, victims, middlemen.",['Anurag Kashyap'],"['Kay Kay Menon', 'Pawan Malhotra', 'Aditya Srivastav', 'Dibyendu Bhattacharya']","21,456",$0.03M
25,Thani Oruvan,(2015),Not Rated,160 min,"Action, Crime, Thriller",8.4,-,"Siddharth Abimanyu, an influential scientist, is involved in various illegal medical practices. Mithran, an efficient IPS officer, decides to expose him.",['Mohan Raja'],"['Jayam Ravi', 'Arvind Swami', 'Nayanthara', 'Nassar']","20,757",-
26,Top Gun: Maverick,(2022),PG-13,130 min,"Action, Drama",8.3,78        ,"After thirty years, Maverick is still pushing the envelope as a top naval aviator, but must confront ghosts of his past when he leads TOP GUN's elite graduates on a mission that demands the ultimate sacrifice from those chosen to fly it.",['Joseph Kosinski'],"['Tom Cruise', 'Jennifer Connelly', 'Miles Teller', 'Val Kilmer']","592,977",$718.73M
27,Heat,(1995),R,170 min,"Action, Crime, Drama",8.3,76        ,A group of high-end professional thieves start to feel the heat from the LAPD when they unknowingly leave a clue at their latest heist.,['Michael Mann'],"['Al Pacino', 'Robert De Niro', 'Val Kilmer', 'Jon Voight']","677,506",$67.44M
28,North by Northwest,(1959),Approved,136 min,"Action, Adventure, Mystery",8.3,98        ,"A New York City advertising executive goes on the run after being mistaken for a government agent by a group of foreign spies, and falls for a woman whose loyalties he begins to doubt.",['Alfred Hitchcock'],"['Cary Grant', 'Eva Marie Saint', 'James Mason', 'Jessie Royce Landis']","334,855",$13.28M
29,Star Wars: Episode VI - Return of the Jedi,(1983),PG,131 min,"Action, Adventure, Fantasy",8.3,58        ,"After rescuing Han Solo from Jabba the Hutt, the Rebels attempt to destroy the second Death Star, while Luke struggles to help Darth Vader back from the dark side.",['Richard Marquand'],"['Mark Hamill', 'Harrison Ford', 'Carrie Fisher', 'Billy Dee Williams']","1,078,692",$309.13M
30,Princess Mononoke,(1997),PG-13,134 min,"Animation, Action, Adventure",8.3,76        ,"On a journey to find the cure for a Tatarigami's curse, Ashitaka finds himself in the middle of a war between the forest gods and Tatara, a mining colony. In this quest he also meets San, the Mononoke Hime.",['Hayao Miyazaki'],"['Yôji Matsuda', 'Yuriko Ishida', 'Yûko Tanaka', 'Billy Crudup']","407,257",$2.38M
31,Kantara,(2022),Not Rated,148 min,"Action, Adventure, Drama",8.3,-,"When greed paves the way for betrayal, scheming and murder, a young tribal reluctantly dons the traditions of his ancestors to seek justice.",['Rishab Shetty'],"['Rishab Shetty', 'Kishore Kumar G.', 'Achyuth Kumar', 'Sapthami Gowda']","95,641",-
32,Dangal,(2016),Not Rated,161 min,"Action, Biography, Drama",8.3,-,Former wrestler Mahavir Singh Phogat and his two wrestler daughters struggle towards glory at the Commonwealth Games in the face of societal oppression.,['Nitesh Tiwari'],"['Aamir Khan', 'Sakshi Tanwar', 'Fatima Sana Shaikh', 'Sanya Malhotra']","197,560",$12.39M
33,Raatchasan,(2018),Not Rated,170 min,"Action, Crime, Drama",8.3,-,A sub-inspector sets out in pursuit of a mysterious serial killer who targets teen school girls and murders them brutally.,['Ram Kumar'],"['Vishnu Vishal', 'Amala Paul', 'Radha Ravi', 'Sangili Murugan']","47,005",-
34,K.G.F: Chapter 2,(2022),Not Rated,168 min,"Action, Crime, Drama",8.3,-,"In the blood-soaked Kolar Gold Fields, Rocky's name strikes fear into his foes. While his allies look up to him, the government sees him as a threat to law and order. Rocky must battle threats from all sides for unchallenged supremacy.",['Prashanth Neel'],"['Yash', 'Sanjay Dutt', 'Raveena Tandon', 'Srinidhi Shetty']","139,767",$6.60M
35,Shershaah,(2021),TV-14,135 min,"Action, Biography, Drama",8.3,-,"Shershaah is the story of PVC awardee Indian soldier Capt. Vikram Batra, whose bravery and unflinching courage in chasing the Pakistani soldiers out of Indian territory contributed immensely in India finally winning the Kargil War in 1999.",['Vishnuvardhan'],"['Sidharth Malhotra', 'Kiara Advani', 'Shiv Panditt', 'Pranay Pachauri']","124,879",-
36,Maanaadu,(2021),PG-13,147 min,"Action, Adventure, Sci-Fi",8.3,-,"On the day of a public conference by the state's Chief Minister, his bodyguard and a police officer are stuck in a time loop.",['Venkat Prabhu'],"['Silambarasan Rajendar', 'S.J. Suryah', 'Kalyani Priyadarshan', 'S.A. Chandrashekhar']","23,890",-
37,Guardians of the Galaxy Vol. 3,(2023),PG-13,150 min,"Action, Adventure, Comedy",8.2,64        ,"Still reeling from the loss of Gamora, Peter Quill rallies his team to defend the universe and one of their own - a mission that could mean the end of the Guardians if not successful.",['James Gunn'],"['Chris Pratt', 'Chukwudi Iwuji', 'Bradley Cooper', 'Pom Klementieff']","161,794",-
38,Spider-Man: No Way Home,(2021),PG-13,148 min,"Action, Adventure, Fantasy",8.2,71        ,"With Spider-Man's identity now revealed, Peter asks Doctor Strange for help. When a spell goes wrong, dangerous foes from other worlds start to appear, forcing Peter to discover what it truly means to be Spider-Man.",['Jon Watts'],"['Tom Holland', 'Zendaya', 'Benedict Cumberbatch', 'Jacob Batalon']","799,654",$804.75M
39,Jurassic Park,(1993),PG-13,127 min,"Action, Adventure, Sci-Fi",8.2,68        ,A pragmatic paleontologist touring an almost complete theme park on an island in Central America is tasked with protecting a couple of kids after a power failure causes the park's cloned dinosaurs to run loose.,['Steven Spielberg'],"['Sam Neill', 'Laura Dern', 'Jeff Goldblum', 'Richard Attenborough']","1,014,997",$402.45M
40,Indiana Jones and the Last Crusade,(1989),PG-13,127 min,"Action, Adventure",8.2,65        ,"In 1938, after his father goes missing while pursuing the Holy Grail, Indiana Jones finds himself up against the Nazis again to stop them from obtaining its powers.",['Steven Spielberg'],"['Harrison Ford', 'Sean Connery', 'Alison Doody', 'Denholm Elliott']","772,147",$197.17M
41,1917,(2019),R,119 min,"Action, Drama, War",8.2,78        ,"April 6th, 1917. As an infantry battalion assembles to wage war deep in enemy territory, two soldiers are assigned to race against time and deliver a message that will stop 1,600 men from walking straight into a deadly trap.",['Sam Mendes'],"['Dean-Charles Chapman', 'George MacKay', 'Daniel Mays', 'Colin Firth']","622,200",$159.23M
42,Batman Begins,(2005),PG-13,140 min,"Action, Crime, Drama",8.2,70        ,"After witnessing his parents' death, Bruce learns the art of fighting to confront injustice. When he returns to Gotham as Batman, he must stop a secret society that intends to destroy the city.",['Christopher Nolan'],"['Christian Bale', 'Michael Caine', 'Ken Watanabe', 'Liam Neeson']","1,504,744",$206.85M
43,Kill Bill: Vol. 1,(2003),R,111 min,"Action, Crime, Drama",8.2,69        ,"After awakening from a four-year coma, a former assassin wreaks vengeance on the team of assassins who betrayed her.",['Quentin Tarantino'],"['Uma Thurman', 'David Carradine', 'Daryl Hannah', 'Michael Madsen']","1,141,783",$70.10M
44,Die Hard,(1988),R,132 min,"Action, Thriller",8.2,72        ,A New York City police officer tries to save his estranged wife and several others taken hostage by terrorists during a Christmas party at the Nakatomi Plaza in Los Angeles.,['John McTiernan'],"['Bruce Willis', 'Alan Rickman', 'Bonnie Bedelia', 'Reginald VelJohnson']","901,988",$83.01M
45,V for Vendetta,(2005),R,132 min,"Action, Drama, Sci-Fi",8.2,62        ,"In a future British dystopian society, a shadowy freedom fighter, known only by the alias of ""V"", plots to overthrow the tyrannical government - with the help of a young woman.",['James McTeigue'],"['Hugo Weaving', 'Natalie Portman', 'Rupert Graves', 'Stephen Rea']","1,141,577",$70.51M
46,Warrior,(2011),PG-13,140 min,"Action, Drama, Sport",8.2,71        ,"The youngest son of an alcoholic former boxer returns home, where he's trained by his father for competition in a mixed martial arts tournament - a path that puts the fighter on a collision course with his estranged, older brother.","[""Gavin O'Connor""]","['Tom Hardy', 'Nick Nolte', 'Joel Edgerton', 'Jennifer Morrison']","482,127",$13.66M
47,Demon Slayer the Movie: Mugen Train,(2020),R,117 min,"Animation, Action, Adventure",8.2,72        ,"After his family was brutally murdered and his sister turned into a demon, Tanjiro Kamado's journey as a demon slayer began. Tanjiro and his comrades embark on a new mission aboard the Mugen Train, on track to despair.",['Haruo Sotozaki'],"['Natsuki Hanae', 'Akari Kitô', 'Yoshitsugu Matsuoka', 'Hiro Shimono']","64,611",$47.70M
48,Ran,(1985),R,162 min,"Action, Drama, War",8.2,97        ,"In Medieval Japan, an elderly warlord retires, handing over his empire to his three sons. However, he vastly underestimates how the new-found power will corrupt them and cause them to turn on each other...and him.",['Akira Kurosawa'],"['Tatsuya Nakadai', 'Akira Terao', 'Jinpachi Nezu', 'Daisuke Ryû']","129,299",$4.14M
49,Gangs of Wasseypur,(2012),Not Rated,321 min,"Action, Comedy, Crime",8.2,89        ,"A clash between Sultan and Shahid Khan leads to the expulsion of Khan from Wasseypur, and ignites a deadly blood feud spanning three generations.",['Anurag Kashyap'],"['Manoj Bajpayee', 'Nawazuddin Siddiqui', 'Tigmanshu Dhulia', 'Richa Chadha']","99,426",-
50,Vikram Vedha,(2017),Not Rated,147 min,"Action, Crime, Drama",8.2,-,"Vikram, a no-nonsense police officer, accompanied by Simon, his partner, is on the hunt to capture Vedha, a smuggler and a murderer. Vedha tries to change Vikram's life, which leads to a conflict.","['Gayatri', 'Pushkar', 'Gowtham Selvaraj']","['Madhavan', 'Vijay Sethupathi', 'Shraddha Srinath', 'Kathir']","47,755",-
51,Yojimbo,(1961),Not Rated,110 min,"Action, Drama, Thriller",8.2,93        ,A crafty ronin comes to a town divided by two criminal gangs and decides to play them against each other to free the town.,['Akira Kurosawa'],"['Toshirô Mifune', 'Eijirô Tôno', 'Tatsuya Nakadai', 'Yôko Tsukasa']","125,980",-
52,Uri: The Surgical Strike,(2019),Not Rated,138 min,"Action, Drama, History",8.2,-,"Indian army special forces execute a covert operation, avenging the killing of fellow army men at their base by a terrorist group.",['Aditya Dhar'],"['Vicky Kaushal', 'Paresh Rawal', 'Mohit Raina', 'Yami Gautam']","67,476",$4.19M
53,Baahubali 2: The Conclusion,(2017),Not Rated,167 min,"Action, Drama",8.2,-,"When Shiva, the son of Bahubali, learns about his heritage, he begins to look for answers. His story is juxtaposed with past events that unfolded in the Mahishmati Kingdom.",['S.S. Rajamouli'],"['Prabhas', 'Rana Daggubati', 'Anushka Shetty', 'Tamannaah Bhatia']","106,854",$20.19M
54,K.G.F: Chapter 1,(2018),Not Rated,156 min,"Action, Crime, Drama",8.2,-,"In the 1970s, a gangster goes undercover as a slave to assassinate the owner of a notorious gold mine.",['Prashanth Neel'],"['Yash', 'Srinidhi Shetty', 'Ramachandra Raju', 'Archana Jois']","91,699",-
55,Rangasthalam 1985,(2018),Not Rated,170 min,"Action, Drama",8.2,-,Chitti Babu begins to suspect his elder brother's life is in danger after they team up to lock horns with their village president and overthrow his unlawful 30 year old regime.,['Sukumar'],"['Ram Charan', 'Samantha Ruth Prabhu', 'Aadhi', 'Jagapathi Babu']","26,171",$3.51M
56,Sherlock Jr.,(1924),Passed,45 min,"Action, Comedy, Romance",8.2,-,"A film projectionist longs to be a detective, and puts his meagre skills to work when he is framed by a rival for stealing his girlfriend's father's pocketwatch.",['Buster Keaton'],"['Buster Keaton', 'Kathryn McGuire', 'Joe Keaton', 'Erwin Connelly']","52,543",$0.98M
57,Paan Singh Tomar,(2012),Not Rated,135 min,"Action, Biography, Crime",8.2,-,"The story of Paan Singh Tomar, an Indian athlete and seven-time national steeplechase champion who becomes one of the most feared dacoits in Chambal Valley after his retirement.",['Tigmanshu Dhulia'],"['Irrfan Khan', 'Mahie Gill', 'Rajesh Abhay', 'Hemendra Dandotiya']","37,062",$0.04M
58,Mad Max: Fury Road,(2015),R,120 min,"Action, Adventure, Sci-Fi",8.1,90        ,"In a post-apocalyptic wasteland, a woman rebels against a tyrannical ruler in search for her homeland with the aid of a group of female prisoners, a psychotic worshiper and a drifter named Max.",['George Miller'],"['Tom Hardy', 'Charlize Theron', 'Nicholas Hoult', 'Zoë Kravitz']","1,031,281",$154.06M
59,Pirates of the Caribbean: The Curse of the Black Pearl,(2003),PG-13,143 min,"Action, Adventure, Fantasy",8.1,63        ,"Blacksmith Will Turner teams up with eccentric pirate ""Captain"" Jack Sparrow to save his love, the governor's daughter, from Jack's former pirate allies, who are now undead.",['Gore Verbinski'],"['Johnny Depp', 'Geoffrey Rush', 'Orlando Bloom', 'Keira Knightley']","1,154,771",$305.41M
60,Blade Runner,(1982),R,117 min,"Action, Drama, Sci-Fi",8.1,84        ,A blade runner must pursue and terminate four replicants who stole a ship in space and have returned to Earth to find their creator.,['Ridley Scott'],"['Harrison Ford', 'Rutger Hauer', 'Sean Young', 'Edward James Olmos']","788,709",$32.87M
61,Ford v Ferrari,(2019),PG-13,152 min,"Action, Biography, Drama",8.1,81        ,American car designer Carroll Shelby and driver Ken Miles battle corporate interference and the laws of physics to build a revolutionary race car for Ford in order to defeat Ferrari at the 24 Hours of Le Mans in 1966.,['James Mangold'],"['Matt Damon', 'Christian Bale', 'Jon Bernthal', 'Caitríona Balfe']","419,982",$117.62M
62,The Terminator,(1984),R,107 min,"Action, Sci-Fi",8.1,84        ,"A human soldier is sent from 2029 to 1984 to stop an almost indestructible cyborg killing machine, sent from the same year, which has been programmed to execute a young woman whose unborn son is the key to humanity's future salvation.",['James Cameron'],"['Arnold Schwarzenegger', 'Linda Hamilton', 'Michael Biehn', 'Paul Winfield']","886,259",$38.40M
63,Logan,(2017),R,137 min,"Action, Drama, Sci-Fi",8.1,77        ,"In a future where mutants are nearly extinct, an elderly and weary Logan leads a quiet life. But when Laura, a mutant child pursued by scientists, comes to him for help, he must get her to safety.",['James Mangold'],"['Hugh Jackman', 'Patrick Stewart', 'Dafne Keen', 'Boyd Holbrook']","788,537",$226.28M
64,How to Train Your Dragon,(2010),PG,98 min,"Animation, Action, Adventure",8.1,75        ,"A hapless young Viking who aspires to hunt dragons becomes the unlikely friend of a young dragon himself, and learns there may be more to the creatures than he assumed.","['Dean DeBlois', 'Chris Sanders']","['Jay Baruchel', 'Gerard Butler', 'Christopher Mintz-Plasse', 'Craig Ferguson']","762,225",$217.58M
65,Rush,(I) (2013),R,123 min,"Action, Biography, Drama",8.1,74        ,The merciless 1970s rivalry between Formula One rivals James Hunt and Niki Lauda.,['Ron Howard'],"['Daniel Brühl', 'Chris Hemsworth', 'Olivia Wilde', 'Alexandra Maria Lara']","491,564",$26.95M
66,"Lock, Stock and Two Smoking Barrels",(1998),R,107 min,"Action, Comedy, Crime",8.1,66        ,"Eddy persuades his three pals to pool money for a vital poker game against a powerful local mobster, Hatchet Harry. Eddy loses, after which Harry gives him a week to pay back 500,000 pounds.",['Guy Ritchie'],"['Jason Flemyng', 'Dexter Fletcher', 'Nick Moran', 'Jason Statham']","595,700",$3.90M
67,The Iron Giant,(1999),PG,86 min,"Animation, Action, Adventure",8.1,85        ,A young boy befriends a giant robot from outer space that a paranoid government agent wants to destroy.,['Brad Bird'],"['Eli Marienthal', 'Harry Connick Jr.', 'Jennifer Aniston', 'Vin Diesel']","209,559",$23.16M
68,Neon Genesis Evangelion: The End of Evangelion,(1997),TV-MA,87 min,"Animation, Action, Drama",8.1,-,Concurrent theatrical ending of the TV series Neon Genesis Evangelion (1995).,"['Hideaki Anno', 'Kazuya Tsurumaki']","['Megumi Ogata', 'Megumi Hayashibara', 'Yûko Miyamura', 'Kotono Mitsuishi']","58,681",-
69,The General,(1926),Passed,67 min,"Action, Adventure, Comedy",8.1,-,"After being rejected by the Confederate military, not realizing it was due to his crucial civilian role, an engineer must single-handedly recapture his beloved locomotive after it is seized by Union spies and return it through enemy lines.","['Clyde Bruckman', 'Buster Keaton']","['Buster Keaton', 'Marion Mack', 'Glen Cavender', 'Jim Farley']","93,965",$1.03M
