,title,year,certificate,time,genre,rating,metascore,simple_desc,directors,stars,votes,gross
145,Captain America: The Winter Soldier,(2014),PG-13,136 min,"Action, Adventure, Sci-Fi",7.8,70        ,"As Steve Rogers struggles to embrace his role in the modern world, he teams up with a fellow Avenger and S.H.I.E.L.D agent, Black Widow, to battle a new threat from history: an assassin known as the Winter Soldier.","['Anthony Russo', 'Joe Russo']","['Chris Evans', 'Samuel L. Jackson', 'Scarlett Johansson', 'Robert Redford']","867,577",$259.77M
146,The Fugitive,(1993),PG-13,130 min,"Action, Crime, Drama",7.8,87        ,"Dr. Richard Kimble, unjustly accused of murdering his wife, must find the real killer while being the target of a nationwide manhunt led by a seasoned U.S. Marshal.",['Andrew Davis'],"['Harrison Ford', 'Tommy Lee Jones', 'Sela Ward', 'Julianne Moore']","304,850",$183.88M
147,Captain Phillips,(2013),PG-13,134 min,"Action, Biography, Crime",7.8,82        ,"The true story of Captain Richard Phillips and the 2009 hijacking by Somali pirates of the U.S.-flagged MV Maersk Alabama, the first American cargo ship to be hijacked in two hundred years.",['Paul Greengrass'],"['Tom Hanks', 'Barkhad Abdi', 'Barkhad Abdirahman', 'Catherine Keener']","473,811",$107.10M
148,The Last Samurai,(2003),R,154 min,"Action, Drama",7.8,55        ,An American military advisor embraces the Samurai culture he was hired to destroy after he is captured in battle.,['Edward Zwick'],"['Tom Cruise', 'Ken Watanabe', 'Billy Connolly', 'William Atherton']","452,518",$111.11M
149,Big Hero 6,(2014),PG,102 min,"Animation, Action, Adventure",7.8,74        ,"A special bond develops between plus-sized inflatable robot Baymax and prodigy Hiro Hamada, who together team up with a group of friends to form a band of high-tech heroes.","['Don Hall', 'Chris Williams']","['Ryan Potter', 'Scott Adsit', 'Jamie Chung', 'T.J. Miller']","477,276",$222.53M
150,I Saw the Devil,(2010),Not Rated,144 min,"Action, Crime, Drama",7.8,67        ,A secret agent exacts revenge on a serial killer through a series of captures and releases.,['Jee-woon Kim'],"['Lee Byung-hun', 'Choi Min-sik', 'Jeon Gook-hwan', 'Ho-jin Chun']","137,329",$0.13M
151,Serenity,(2005),PG-13,119 min,"Action, Adventure, Sci-Fi",7.8,74        ,The crew of the ship Serenity try to evade an assassin sent to recapture telepath River.,['Joss Whedon'],"['Nathan Fillion', 'Gina Torres', 'Chiwetel Ejiofor', 'Alan Tudyk']","300,405",$25.51M
152,The Fighter,(I) (2010),R,116 min,"Action, Biography, Drama",7.8,79        ,"Based on the story of Micky Ward, a fledgling boxer who tries to escape the shadow of his more famous but troubled older boxing brother and get his own shot at greatness.",['David O. Russell'],"['Mark Wahlberg', 'Christian Bale', 'Amy Adams', 'Melissa Leo']","377,297",$93.62M
153,Thirteen Lives,(2022),PG-13,147 min,"Action, Adventure, Biography",7.8,66        ,A rescue mission is assembled in Thailand where a group of young boys and their soccer coach are trapped in a system of underground caves that are flooding.,['Ron Howard'],"['Viggo Mortensen', 'Colin Farrell', 'Joel Edgerton', 'Tom Bateman']","60,861",-
154,How to Train Your Dragon 2,(2014),PG,102 min,"Animation, Action, Adventure",7.8,77        ,"When Hiccup and Toothless discover an ice cave that is home to hundreds of new wild dragons and the mysterious Dragon Rider, the two friends find themselves at the center of a battle to protect the peace.",['Dean DeBlois'],"['Jay Baruchel', 'Cate Blanchett', 'Gerard Butler', 'Craig Ferguson']","348,022",$177.00M
155,Jujutsu Kaisen 0,(2021),PG-13,112 min,"Animation, Action, Fantasy",7.8,71        ,"Yuta Okkotsu, a high schooler who gains control of an extremely powerful Cursed Spirit and gets enrolled in the Tokyo Prefectural Jujutsu High School by Jujutsu Sorcerers to help him control his power and keep an eye on him.",['Seong-Hu Park'],"['Chinatsu Akasaki', 'Aya Endô', 'Kana Hanazawa', 'Show Hayami']","23,961",$34.54M
156,The Chaser,(2008),Not Rated,125 min,"Action, Crime, Drama",7.8,64        ,A disgraced ex-policeman who runs a small ring of prostitutes finds himself in a race against time when one of his women goes missing.,['Na Hong-jin'],"['Kim Yoon-seok', 'Ha Jung-woo', 'Yeong-hie Seo', 'Kim Yoo-jeong']","69,255",-
157,Ninja Scroll,(1993),Not Rated,94 min,"Animation, Action, Adventure",7.8,-,A vagabond swordsman is aided by a kunoichi and a spy in battling a demonic clan of killers - led by a ghost from his past - who are bent on overthrowing the Tokugawa Shogunate.,['Yoshiaki Kawajiri'],"['Kôichi Yamadera', 'Emi Shinohara', 'Takeshi Aono', 'Osamu Saka']","38,914",-
158,Batman: Mask of the Phantasm,(1993),PG,76 min,"Animation, Action, Adventure",7.8,65        ,Batman is wrongly implicated in a series of murders of mob bosses actually done by a new vigilante assassin.,"['Eric Radomski', 'Kevin Altieri', 'Boyd Kirkland', 'Frank Paur', 'Dan Riba', 'Bruce Timm']","['Kevin Conroy', 'Dana Delany', 'Hart Bochner', 'Stacy Keach']","53,580",$5.62M
159,"Aguirre, the Wrath of God",(1972),Not Rated,95 min,"Action, Adventure, Biography",7.8,-,"In the 16th century, the ruthless and insane Don Lope de Aguirre leads a Spanish expedition in search of El Dorado.",['Werner Herzog'],"['Klaus Kinski', 'Ruy Guerra', 'Helena Rojo', 'Del Negro']","59,165",-
160,Cowboy Bebop: The Movie,(2001),TV-14,115 min,"Animation, Action, Crime",7.8,61        ,"A terrorist explosion releases a deadly virus on the masses, and it's up to the bounty-hunting Bebop crew to catch the cold-blooded culprit.","[""Shin'ichirô Watanabe"", 'Tensai Okamura', 'Hiroyuki Okiura', 'Yoshiyuki Takei']","['Beau Billingslea', 'Melissa Fahn', 'Nicholas Guest', 'Kôichi Yamadera']","50,707",$1.00M
161,The Killer,(1989),R,111 min,"Action, Crime, Drama",7.8,82        ,A disillusioned assassin accepts one last hit in hopes of using his earnings to restore vision to a singer he accidentally blinded.,['John Woo'],"['Chow Yun-Fat', 'Danny Lee', 'Sally Yeh', 'Kong Chu']","49,609",-
162,Knockin' on Heaven's Door,(1997),Not Rated,87 min,"Action, Crime, Comedy",7.8,-,"Two terminally ill patients escape from a hospital, steal a car and rush towards the sea.",['Thomas Jahn'],"['Til Schweiger', 'Jan Josef Liefers', 'Thierry van Werveke', 'Moritz Bleibtreu']","32,118",$0.00M
163,Minnal Murali,(2021),TV-14,158 min,"Action, Comedy, Drama",7.8,-,"An unusual event creates a lightning which in turns gives superhuman abilies to an ambitious tailor ,whose responsibility is now to protect his home village from the evil plans of the antagonist.",['Basil Joseph'],"['Tovino Thomas', 'Guru Somasundaram', 'Aju Varghese', 'Baiju']","31,136",-
164,Lakshya,(2004),Not Rated,186 min,"Action, Drama, Romance",7.8,-,"An aimless, jobless, irresponsible grown man joins the army and matures into a battlefield hero.",['Farhan Akhtar'],"['Hrithik Roshan', 'Preity G Zinta', 'Amitabh Bachchan', 'Om Puri']","24,248",$0.75M
165,Avatar: The Way of Water,(2022),PG-13,192 min,"Action, Adventure, Fantasy",7.7,67        ,"Jake Sully lives with his newfound family formed on the extrasolar moon Pandora. Once a familiar threat returns to finish what was previously started, Jake must work with Neytiri and the army of the Na'vi race to protect their home.",['James Cameron'],"['Sam Worthington', 'Zoe Saldana', 'Sigourney Weaver', 'Stephen Lang']","390,907",$659.68M
166,Kingsman: The Secret Service,(2014),R,129 min,"Action, Adventure, Comedy",7.7,60        ,"A spy organisation recruits a promising street kid into the agency's training program, while a global threat emerges from a twisted tech genius.",['Matthew Vaughn'],"['Colin Firth', 'Taron Egerton', 'Samuel L. Jackson', 'Michael Caine']","687,332",$128.26M
167,Black Hawk Down,(2001),R,144 min,"Action, Drama, History",7.7,74        ,"The story of 160 elite U.S. soldiers who dropped into Mogadishu in October 1993 to capture two top lieutenants of a renegade warlord, but found themselves in a desperate battle with a large force of heavily armed Somalis.",['Ridley Scott'],"['Josh Hartnett', 'Ewan McGregor', 'Tom Sizemore', 'Eric Bana']","407,701",$108.64M
168,Mission: Impossible - Fallout,(2018),PG-13,147 min,"Action, Adventure, Thriller",7.7,86        ,"Ethan Hunt and his IMF team, along with some familiar allies, race against time after a mission gone wrong.",['Christopher McQuarrie'],"['Tom Cruise', 'Henry Cavill', 'Ving Rhames', 'Simon Pegg']","345,424",$220.16M
169,The Dirty Dozen,(1967),Approved,150 min,"Action, Adventure, War",7.7,73        ,"During World War II, a rebellious U.S. Army Major is assigned a dozen convicted murderers to train and lead them into a mass assassination mission of German officers.",['Robert Aldrich'],"['Lee Marvin', 'Ernest Borgnine', 'Charles Bronson', 'John Cassavetes']","76,186",$45.30M
170,The Count of Monte Cristo,(2002),PG-13,131 min,"Action, Adventure, Drama",7.7,61        ,"A young man, falsely imprisoned by his jealous ""friend"", escapes and uses a hidden treasure to exact his revenge.",['Kevin Reynolds'],"['Jim Caviezel', 'Guy Pearce', 'Christopher Adamson', 'JB Blanc']","142,804",$54.23M
171,3:10 to Yuma,(2007),R,122 min,"Action, Crime, Drama",7.7,76        ,A small-time rancher agrees to hold a captured outlaw who's awaiting a train to go to court in Yuma. A battle of wills ensues as the outlaw tries to psych out the rancher.,['James Mangold'],"['Russell Crowe', 'Christian Bale', 'Ben Foster', 'Logan Lerman']","320,611",$53.61M
172,The Lego Movie,(2014),PG,100 min,"Animation, Action, Adventure",7.7,83        ,"An ordinary LEGO construction worker, thought to be the prophesied as ""special"", is recruited to join a quest to stop an evil tyrant from gluing the LEGO universe into eternal stasis.","['Phil Lord', 'Christopher Miller']","['Chris Pratt', 'Will Ferrell', 'Elizabeth Banks', 'Will Arnett']","370,021",$257.76M
173,Star Trek Into Darkness,(2013),PG-13,132 min,"Action, Adventure, Sci-Fi",7.7,72        ,"After the crew of the Enterprise find an unstoppable force of terror from within their own organization, Captain Kirk leads a manhunt to a war-zone world to capture a one-man weapon of mass destruction.",['J.J. Abrams'],"['Chris Pine', 'Zachary Quinto', 'Zoe Saldana', 'Benedict Cumberbatch']","489,526",$228.78M
174,The Last of the Mohicans,(1992),R,112 min,"Action, Adventure, Drama",7.7,76        ,Three trappers protect the daughters of a British Colonel in the midst of the French and Indian War.,['Michael Mann'],"['Daniel Day-Lewis', 'Madeleine Stowe', 'Russell Means', 'Eric Schweig']","177,764",$75.51M
175,Training Day,(2001),R,122 min,"Action, Crime, Drama",7.7,69        ,A rookie cop spends his first day as a Los Angeles narcotics officer with a rogue detective who isn't what he appears to be.,['Antoine Fuqua'],"['Denzel Washington', 'Ethan Hawke', 'Scott Glenn', 'Tom Berenger']","450,711",$76.63M
176,Man on Fire,(2004),R,146 min,"Action, Crime, Drama",7.7,47        ,"In Mexico City, a former CIA operative swears vengeance on those who committed an unspeakable act against the family he was hired to protect.",['Tony Scott'],"['Denzel Washington', 'Christopher Walken', 'Dakota Fanning', 'Radha Mitchell']","372,307",$77.91M
177,X: First Class,(2011),PG-13,131 min,"Action, Sci-Fi",7.7,65        ,"In the 1960s, superpowered humans Charles Xavier and Erik Lensherr work together to find others like them, but Erik's vengeful pursuit of an ambitious mutant who ruined his life causes a schism to divide them.",['Matthew Vaughn'],"['James McAvoy', 'Michael Fassbender', 'Jennifer Lawrence', 'Kevin Bacon']","705,293",$146.41M
178,The Longest Day,(1962),G,178 min,"Action, Drama, History",7.7,75        ,"The events of D-Day, told on a grand scale from both the Allied and German points of view.","['Ken Annakin', 'Andrew Marton', 'Gerd Oswald', 'Bernhard Wicki', 'Darryl F. Zanuck']","['John Wayne', 'Robert Ryan', 'Richard Burton', 'Henry Fonda']","57,510",$39.10M
179,The Bourne Supremacy,(2004),PG-13,108 min,"Action, Mystery, Thriller",7.7,73        ,"When Jason Bourne is framed for a CIA operation gone awry, he is forced to resume his former life as a trained assassin to survive.",['Paul Greengrass'],"['Matt Damon', 'Franka Potente', 'Joan Allen', 'Brian Cox']","473,851",$176.24M
180,The Magnificent Seven,(1960),Approved,128 min,"Action, Adventure, Drama",7.7,74        ,Seven gunfighters are hired by Mexican peasants to liberate their village from oppressive bandits.,['John Sturges'],"['Yul Brynner', 'Steve McQueen', 'Charles Bronson', 'Eli Wallach']","98,375",$4.91M
181,First Blood,(1982),R,93 min,"Action, Adventure, Thriller",7.7,61        ,A veteran Green Beret is forced by a cruel Sheriff and his deputies to flee into the mountains and wage an escalating one-man war against his pursuers.,['Ted Kotcheff'],"['Sylvester Stallone', 'Brian Dennehy', 'Richard Crenna', 'Bill McKinney']","262,556",$47.21M
182,Kung Fu Hustle,(2004),R,99 min,"Action, Comedy, Fantasy",7.7,78        ,"In Shanghai, China in the 1940s, a wannabe gangster aspires to join the notorious ""Axe Gang"" while residents of a housing complex exhibit extraordinary powers in defending their turf.",['Stephen Chow'],"['Stephen Chow', 'Wah Yuen', 'Qiu Yuen', 'Siu-Lung Leung']","144,672",$17.11M
183,The Boondock Saints,(1999),R,108 min,"Action, Thriller",7.7,44        ,Two Irish Catholic brothers become vigilantes and wipe out Boston's criminal underworld in the name of God.,['Troy Duffy'],"['Willem Dafoe', 'Sean Patrick Flanery', 'Norman Reedus', 'David Della Rocco']","243,563",$0.03M
184,Dirty Harry,(1971),R,102 min,"Action, Crime, Thriller",7.7,87        ,"When a man calling himself ""the Scorpio Killer"" menaces San Francisco, tough-as-nails Police Inspector ""Dirty"" Harry Callahan is assigned to track down the crazed psychopath.","['Don Siegel', 'Clint Eastwood']","['Clint Eastwood', 'Andrew Robinson', 'Harry Guardino', 'Reni Santoni']","161,924",$35.90M
185,Goldfinger,(1964),PG,110 min,"Action, Adventure, Thriller",7.7,87        ,"While investigating a gold magnate's smuggling, James Bond uncovers a plot to contaminate the Fort Knox gold reserve.",['Guy Hamilton'],"['Sean Connery', 'Gert Fröbe', 'Honor Blackman', 'Shirley Eaton']","195,818",$51.08M
186,Star Trek II: The Wrath of Khan,(1982),PG,113 min,"Action, Adventure, Sci-Fi",7.7,68        ,"With the assistance of the Enterprise crew, Admiral Kirk must stop an old nemesis, Khan Noonien Singh, from using the life-generating Genesis Device as the ultimate weapon.",['Nicholas Meyer'],"['William Shatner', 'Leonard Nimoy', 'DeForest Kelley', 'James Doohan']","125,305",$78.91M
187,Bonnie and Clyde,(1967),R,111 min,"Action, Biography, Crime",7.7,86        ,"Bored waitress Bonnie Parker falls in love with an ex-con named Clyde Barrow and together they start a violent crime spree through the country, stealing cars and robbing banks.",['Arthur Penn'],"['Warren Beatty', 'Faye Dunaway', 'Michael J. Pollard', 'Gene Hackman']","116,585",-
188,The French Connection,(1971),R,104 min,"Action, Crime, Drama",7.7,94        ,"A pair of NYPD detectives in the Narcotics Bureau stumble onto a heroin smuggling ring based in Marseilles, but stopping them and capturing their leaders proves an elusive goal.",['William Friedkin'],"['Gene Hackman', 'Roy Scheider', 'Fernando Rey', 'Tony Lo Bianco']","127,753",$15.63M
189,Run Lola Run,(1998),R,80 min,"Action, Crime, Thriller",7.7,77        ,"After a botched money delivery, Lola has 20 minutes to come up with 100,000 Deutschmarks.",['Tom Tykwer'],"['Franka Potente', 'Moritz Bleibtreu', 'Herbert Knaup', 'Nina Petri']","202,437",$7.27M
190,The Man from Nowhere,(2010),R,119 min,"Action, Crime, Drama",7.7,-,A quiet pawnshop keeper with a violent past takes on a drug-and-organ trafficking ring in hope of saving the child who is his only friend.,['Jeong-beom Lee'],"['Won Bin', 'Kim Sae-ron', 'Kim Tae-hoon', 'Kim Hee-won']","72,035",$0.01M
191,Kubo and the Two Strings,(2016),PG,101 min,"Animation, Action, Adventure",7.7,84        ,A young boy named Kubo must locate a magical suit of armour worn by his late father in order to defeat a vengeful spirit from the past.,['Travis Knight'],"['Charlize Theron', 'Art Parkinson', 'Matthew McConaughey', 'Ralph Fiennes']","133,762",$48.02M
192,Badlands,(1973),PG,94 min,"Action, Crime, Drama",7.7,93        ,"An impressionable teenage girl from a dead-end town, and her older greaser boyfriend, embark on a killing spree in the South Dakota Badlands.",['Terrence Malick'],"['Martin Sheen', 'Sissy Spacek', 'Warren Oates', 'Ramon Bieri']","75,376",-
193,Ponniyin Selvan: Part I,(2022),Not Rated,167 min,"Action, Adventure, Drama",7.7,-,"Vandiyathevan sets out to cross the Chola land to deliver a message from the Crown Prince Aditha Karikalan. Kundavai attempts to establish political peace as vassals and petty chieftains plot against the throne. Unrest grips the land as a long-tailed comet arrives, signalling a time of turmoil.",['Mani Ratnam'],"['Vikram', 'Aishwarya Rai Bachchan', 'Jayam Ravi', 'Karthi']","33,833",-
194,Key Largo,(1948),Not Rated,100 min,"Action, Crime, Drama",7.7,-,"A man visits his war buddy's family hotel and finds a gangster running things. As a hurricane approaches, the two end up confronting each other.",['John Huston'],"['Humphrey Bogart', 'Edward G. Robinson', 'Lauren Bacall', 'Lionel Barrymore']","42,580",-
195,Scarface,(1932),PG,93 min,"Action, Crime, Drama",7.7,90        ,"An ambitious and nearly insane violent gangster climbs the ladder of success in the mob, but his weaknesses prove to be his downfall.","['Howard Hawks', 'Richard Rosson']","['Paul Muni', 'Ann Dvorak', 'Karen Morley', 'Osgood Perkins']","29,125",-
196,Hard Boiled,(1992),R,128 min,"Action, Crime, Thriller",7.7,-,A tough-as-nails cop teams up with an undercover agent to shut down a sinister mobster and his crew.,['John Woo'],"['Chow Yun-Fat', 'Tony Leung Chiu-wai', 'Teresa Mo', 'Philip Chan']","52,170",-
197,Joint Security Area,(2000),Not Rated,110 min,"Action, Drama, Thriller",7.7,58        ,"After a shooting incident at the North/South Korean border/DMZ leaves 2 North Korean soldiers dead, a neutral Swiss/Swedish team investigates, what actually happened.",['Park Chan-wook'],"['Lee Yeong-ae', 'Lee Byung-hun', 'Song Kang-ho', 'Kim Tae-woo']","32,221",-
198,Dragon Ball Super: Broly,(2018),PG,100 min,"Animation, Action, Adventure",7.7,59        ,"Goku and Vegeta encounter Broly, a Saiyan warrior unlike any fighter they've faced before.",['Tatsuya Nagamine'],"['Masako Nozawa', 'Aya Hisakawa', 'Ryô Horikawa', 'Toshio Furukawa']","29,498",$30.71M
199,Eega,(2012),Not Rated,145 min,"Action, Comedy, Drama",7.7,-,A murdered man is reincarnated as a housefly and seeks to avenge his death.,['S.S. Rajamouli'],"['Sudeep', 'Nani', 'Samantha Ruth Prabhu', 'Hamsa Nandini']","25,966",-
200,Udta Punjab,(2016),Not Rated,148 min,"Action, Crime, Drama",7.7,-,A story that revolves around drug abuse in the affluent north Indian State of Punjab and how the youth there have succumbed to it en-masse resulting in a socio-economic decline.,['Abhishek Chaubey'],"['Shahid Kapoor', 'Alia Bhatt', 'Kareena Kapoor', 'Diljit Dosanjh']","31,418",-
201,Raazi,(2018),Not Rated,138 min,"Action, Drama, Thriller",7.7,-,A Kashmiri woman agrees to marry a Pakistani army officer in order to spy on Pakistan during the Indo-Pakistan War of 1971.,['Meghna Gulzar'],"['Alia Bhatt', 'Vicky Kaushal', 'Rajit Kapoor', 'Shishir Sharma']","32,314",-
202,Magadheera,(2009),Not Rated,147 min,"Action, Drama, Fantasy",7.7,-,"A warrior gets reincarnated 400 years later, after trying to save the princess and the kingdom, who also dies along with him. He then sets back again to fight against all odds and win back his love.",['S.S. Rajamouli'],"['Ram Charan', 'Kajal Aggarwal', 'Dev Gill', 'Srihari']","23,900",-
203,Guardians of the Galaxy Vol. 2,(2017),PG-13,136 min,"Action, Adventure, Comedy",7.6,67        ,"The Guardians struggle to keep together as a team while dealing with their personal family issues, notably Star-Lord's encounter with his father, the ambitious celestial being Ego.",['James Gunn'],"['Chris Pratt', 'Zoe Saldana', 'Dave Bautista', 'Vin Diesel']","717,247",$389.81M
204,Deadpool 2,(2018),R,119 min,"Action, Adventure, Comedy",7.6,66        ,"Foul-mouthed mutant mercenary Wade Wilson (a.k.a. Deadpool) assembles a team of fellow mutant rogues to protect a young boy with supernatural abilities from the brutal, time-traveling cyborg Cable.",['David Leitch'],"['Ryan Reynolds', 'Josh Brolin', 'Morena Baccarin', 'Julian Dennison']","606,182",$324.59M
205,The Fifth Element,(1997),PG-13,126 min,"Action, Adventure, Sci-Fi",7.6,52        ,"In the colorful future, a cab driver unwittingly becomes the central figure in the search for a legendary cosmic weapon to keep Evil and Mr. Zorg at bay.",['Luc Besson'],"['Bruce Willis', 'Milla Jovovich', 'Gary Oldman', 'Ian Holm']","486,536",$63.54M
206,Sicario,(2015),R,121 min,"Action, Crime, Drama",7.6,82        ,An idealistic FBI agent is enlisted by a government task force to aid in the escalating war against drugs at the border area between the U.S. and Mexico.,['Denis Villeneuve'],"['Emily Blunt', 'Josh Brolin', 'Benicio Del Toro', 'Jon Bernthal']","446,787",$46.89M
207,300,(2006),R,117 min,"Action, Drama",7.6,52        ,King Leonidas of Sparta and a force of 300 men fight the Persians at Thermopylae in 480 B.C.,['Zack Snyder'],"['Gerard Butler', 'Lena Headey', 'David Wenham', 'Dominic West']","837,090",$210.61M
208,Harry Potter and the Half-Blood Prince,(2009),PG,153 min,"Action, Adventure, Family",7.6,78        ,"As Harry Potter begins his sixth year at Hogwarts, he discovers an old book marked as ""the property of the Half-Blood Prince"" and begins to learn more about Lord Voldemort's dark past.",['David Yates'],"['Daniel Radcliffe', 'Emma Watson', 'Rupert Grint', 'Michael Gambon']","564,882",$301.96M
209,Star Wars: Episode III - Revenge of the Sith,(2005),PG-13,140 min,"Action, Adventure, Fantasy",7.6,68        ,"Three years into the Clone Wars, Obi-Wan pursues a new threat, while Anakin is lured by Chancellor Palpatine into a sinister plot to rule the galaxy.",['George Lucas'],"['Hayden Christensen', 'Natalie Portman', 'Ewan McGregor', 'Samuel L. Jackson']","812,677",$380.26M
210,Baby Driver,(2017),R,113 min,"Action, Crime, Drama",7.6,86        ,"After being coerced into working for a crime boss, a young getaway driver finds himself taking part in a heist doomed to fail.",['Edgar Wright'],"['Ansel Elgort', 'Jon Bernthal', 'Jon Hamm', 'Eiza González']","567,587",$107.83M
211,Watchmen,(2009),R,162 min,"Action, Drama, Mystery",7.6,56        ,"In 1985 where former superheroes exist, the murder of a colleague sends active vigilante Rorschach into his own sprawling investigation, uncovering something that could completely change the course of history as we know it.",['Zack Snyder'],"['Jackie Earle Haley', 'Patrick Wilson', 'Carla Gugino', 'Malin Akerman']","563,150",$107.51M
212,Incredibles 2,(2018),PG,118 min,"Animation, Action, Adventure",7.6,80        ,The Incredibles family takes on a new mission which involves a change in family roles: Bob Parr (Mr. Incredible) must manage the house while his wife Helen (Elastigirl) goes out to save the world.,['Brad Bird'],"['Craig T. Nelson', 'Holly Hunter', 'Sarah Vowell', 'Huck Milner']","310,148",$608.58M
213,Where Eagles Dare,(1968),M,158 min,"Action, Adventure, War",7.6,63        ,"Allied agents stage a daring raid on a castle where the Nazis are holding American brigadier general George Carnaby prisoner, but that's not all that's really going on.",['Brian G. Hutton'],"['Richard Burton', 'Clint Eastwood', 'Mary Ure', 'Patrick Wymark']","60,577",-
214,RoboCop,(1987),R,102 min,"Action, Crime, Sci-Fi",7.6,70        ,"In a dystopic and crime-ridden Detroit, a terminally wounded cop returns to the force as a powerful cyborg haunted by submerged memories.",['Paul Verhoeven'],"['Peter Weller', 'Nancy Allen', ""Dan O'Herlihy"", 'Ronny Cox']","267,793",$53.42M
215,Train to Busan,(2016),Not Rated,118 min,"Action, Horror, Thriller",7.6,73        ,"While a zombie virus breaks out in South Korea, passengers struggle to survive on the train from Seoul to Busan.",['Sang-ho Yeon'],"['Gong Yoo', 'Jung Yu-mi', 'Ma Dong-seok', 'Su-an Kim']","235,072",$2.13M
216,Zombieland,(2009),R,88 min,"Action, Comedy, Horror",7.6,73        ,"A shy student trying to reach his family in Ohio, a gun-toting bruiser in search of the last Twinkie and a pair of sisters striving to get to an amusement park join forces in a trek across a zombie-filled America.",['Ruben Fleischer'],"['Jesse Eisenberg', 'Emma Stone', 'Woody Harrelson', 'Abigail Breslin']","595,901",$75.59M
217,Kung Fu Panda,(2008),PG,92 min,"Animation, Action, Adventure",7.6,74        ,"To everyone's surprise, including his own, Po, an overweight, clumsy panda, is chosen as protector of the Valley of Peace. His suitability will soon be tested as the valley's arch-enemy is on his way.","['Mark Osborne', 'John Stevenson']","['Jack Black', 'Ian McShane', 'Angelina Jolie', 'Dustin Hoffman']","489,396",$215.43M
218,Creed,(II) (2015),PG-13,133 min,"Action, Drama, Sport",7.6,82        ,"The former World Heavyweight Champion Rocky Balboa serves as a trainer and mentor to Adonis Johnson, the son of his late friend and former rival Apollo Creed.",['Ryan Coogler'],"['Michael B. Jordan', 'Sylvester Stallone', 'Tessa Thompson', 'Phylicia Rashad']","297,087",$109.77M
219,The Road Warrior,(1981),R,96 min,"Action, Adventure, Sci-Fi",7.6,77        ,"In the post-apocalyptic Australian wasteland, a cynical drifter agrees to help a small, gasoline-rich community escape a horde of bandits.",['George Miller'],"['Mel Gibson', 'Bruce Spence', 'Michael Preston', 'Max Phipps']","186,307",$12.47M
