,title,year,certificate,time,genre,rating,metascore,simple_desc,directors,stars,votes,gross
215,The Dark Crystal,(1982),PG,93 min,"Adventure, Family, Fantasy",7.1,66        ,"On another planet in the distant past, a Gelfling embarks on a quest to find the missing shard of a magical crystal, and to restore order to his world.","['Jim Henson', 'Frank Oz']","['Jim Henson', 'Kathryn Mullen', 'Frank Oz', 'Dave Goelz']","69,165",$40.58M
216,The Sword in the Stone,(1963),G,79 min,"Animation, Adventure, Comedy",7.1,61        ,"A poor boy named Arthur learns the power of love, kindness, knowledge and bravery with the help of a wizard called Merlin in the path to become one of the most beloved kings in English history.","['Wolfgang Reitherman', 'Clyde Geronimi', 'David Hand']","['Rickie Sorensen', 'Sebastian Cabot', 'Karl Swenson', 'Junius Matthews']","102,085",$22.18M
217,Winnie the Pooh,(2011),G,63 min,"Animation, Adventure, Comedy",7.1,74        ,"While searching for honey, Pooh and his friends embark on an adventure to find Eeyore's missing tail and rescue Christopher Robin from an unknown monster called The Backson.","['Stephen J. Anderson', 'Don Hall']","['Jim Cummings', 'Craig Ferguson', 'John Cleese', 'Bud Luckey']","26,740",$26.69M
218,The Great Mouse Detective,(1986),G,74 min,"Animation, Adventure, Family",7.1,73        ,"Basil, the rodent Sherlock Holmes, investigates the kidnapping of a toy maker and uncovers its link to his archenemy, Professor Ratigan.","['Ron Clements', 'Burny Mattinson', 'David Michener', 'John Musker']","['Vincent Price', 'Barrie Ingham', 'Val Bettin', 'Susanne Pollatschek']","51,920",$38.60M
219,The Cat Returns,(2002),G,75 min,"Animation, Adventure, Comedy",7.1,70        ,"After helping a cat, a seventeen-year-old girl finds herself involuntarily engaged to a cat Prince in a magical world where her only hope of freedom lies with a dapper cat statuette come to life.",['Hiroyuki Morita'],"['Chizuru Ikewaki', 'Yoshihiko Hakamada', 'Aki Maeda', 'Takayuki Yamada']","59,906",-
220,Balto,(1995),G,78 min,"Animation, Adventure, Drama",7.1,-,"An outcast Husky risks his life with other sled dogs to prevent a deadly epidemic from ravaging Nome, Alaska.",['Simon Wells'],"['Kevin Bacon', 'Bob Hoskins', 'Bridget Fonda', 'Jim Cummings']","45,892",$11.35M
221,Goodbye Christopher Robin,(2017),PG,107 min,"Biography, Drama, Family",7.1,54        ,"The relationship between writer AA Milne and his son, Christopher Robin, and how this became the inspiration for Winnie the Pooh.",['Simon Curtis'],"['Domhnall Gleeson', 'Margot Robbie', 'Kelly Macdonald', 'Vicki Pepperdine']","28,606",$1.74M
222,Fantasia 2000,(1999),G,75 min,"Animation, Family, Fantasy",7.1,59        ,An update of the original film with new interpretations of great works of classical music.,"['James Algar', 'Gaëtan Brizzi', 'Paul Brizzi', 'Hendel Butoy', 'Francis Glebas', 'Eric Goldberg', 'Don Hahn', 'Pixote Hunt']","['James Levine', 'Steve Martin', 'Itzhak Perlman', 'Quincy Jones']","39,955",$60.66M
223,Dragon Ball Z: Battle of Gods,(2013),TV-PG,85 min,"Animation, Action, Adventure",7.1,-,"The Z-Fighters must contend with Lord Beerus, the God of Destruction, but only a God can fight a God, and none of them are Gods. However with the creation of the Super Saiyan God, will the Z-Fighters be able to defeat Lord Beerus?",['Masahiro Hosoda'],"['Masako Nozawa', 'Hiromi Tsuru', 'Ryô Horikawa', 'Masaharu Satô']","28,950",$2.55M
224,Arthur Christmas,(2011),PG,97 min,"Animation, Adventure, Comedy",7.1,69        ,Santa's clumsy son Arthur sets out on a mission with Grandsanta to give out a present they misplaced to a young girl in less than two hours.,"['Sarah Smith', 'Barry Cook']","['James McAvoy', 'Jim Broadbent', 'Bill Nighy', 'Hugh Laurie']","63,175",$46.46M
225,Matilda,(1996),PG,102 min,"Comedy, Family, Fantasy",7.0,72        ,"A girl gifted with a keen intellect and psychic powers uses both to deal with her crude, distant family and free her kind teacher from their sadistic headmistress.",['Danny DeVito'],"['Danny DeVito', 'Rhea Perlman', 'Mara Wilson', 'Embeth Davidtz']","164,086",$33.08M
226,Holes,(2003),PG,117 min,"Adventure, Comedy, Drama",7.0,71        ,A wrongfully convicted boy is sent to a brutal desert detention camp where he joins the job of digging holes for some mysterious reason.,['Andrew Davis'],"['Shia LaBeouf', 'Sigourney Weaver', 'Jon Voight', 'Tim Blake Nelson']","94,271",$67.41M
227,Jumanji,(1995),PG,104 min,"Adventure, Comedy, Family",7.0,39        ,"When two kids find and play a magical board game, they release a man trapped in it for decades - and a host of dangers that can only be stopped by finishing the game.",['Joe Johnston'],"['Robin Williams', 'Kirsten Dunst', 'Bonnie Hunt', 'Jonathan Hyde']","358,744",$100.48M
228,Turning Red,(2022),PG,100 min,"Animation, Adventure, Comedy",7.0,83        ,A 13-year-old girl named Meilin turns into a giant red panda whenever she gets too excited.,['Domee Shi'],"['Rosalie Chiang', 'Sandra Oh', 'Ava Morse', 'Hyein Park']","134,850",-
229,Hotel Transylvania,(2012),PG,91 min,"Animation, Adventure, Comedy",7.0,47        ,"Dracula, who operates a high-end resort away from the human world, goes into overprotective mode when a boy discovers the resort and falls for the count's teenaged daughter.",['Genndy Tartakovsky'],"['Adam Sandler', 'Kevin James', 'Andy Samberg', 'Selena Gomez']","266,120",$148.31M
230,Ralph Breaks the Internet,(2018),PG,112 min,"Animation, Adventure, Comedy",7.0,71        ,"Six years after the events of ""Wreck-It Ralph,"" Ralph and Vanellope, now friends, discover a wi-fi router in their arcade, leading them into a new adventure.","['Phil Johnston', 'Rich Moore']","['John C. Reilly', 'Sarah Silverman', 'Gal Gadot', 'Taraji P. Henson']","170,271",$201.09M
231,The Hunchback of Notre Dame,(1996),G,91 min,"Animation, Drama, Family",7.0,74        ,"A deformed bell-ringer must assert his independence from a vicious government minister in order to help his friend, a gypsy dancer.","['Gary Trousdale', 'Kirk Wise']","['Demi Moore', 'Jason Alexander', 'Mary Kay Bergman', 'Corey Burton']","164,130",$100.14M
232,Hairspray,(1988),PG,92 min,"Comedy, Drama, Family",7.0,77        ,A 'pleasantly plump' teenager teaches 1962 Baltimore a thing or two about integration after landing a spot on a local TV dance show.,['John Waters'],"['Sonny Bono', 'Ruth Brown', 'Divine', 'Debbie Harry']","22,457",$6.67M
233,The Sea Beast,(2022),PG,115 min,"Animation, Adventure, Comedy",7.0,74        ,"When a young girl stows away on the ship of a legendary sea monster hunter, they launch an epic journey into uncharted waters - and make history to boot.",['Chris Williams'],"['Karl Urban', 'Zaris-Angel Hator', 'Jared Harris', 'Marianne Jean-Baptiste']","52,394",-
234,Chip 'n Dale: Rescue Rangers,(2022),PG,97 min,"Animation, Action, Adventure",7.0,66        ,"Thirty years after their popular television show ended, chipmunks Chip and Dale live very different lives. When a cast member from the original series mysteriously disappears, the pair must reunite to save their friend.",['Akiva Schaffer'],"['Andy Samberg', 'John Mulaney', 'KiKi Layne', 'Will Arnett']","43,721",-
235,Cool Runnings,(1993),PG,98 min,"Adventure, Comedy, Family",7.0,60        ,"When a Jamaican sprinter is disqualified from the Olympic Games, he enlists the help of a dishonored coach to start the first Jamaican Bobsled Team.",['Jon Turteltaub'],"['John Candy', 'Leon', 'Doug E. Doug', 'Rawle D. Lewis']","108,579",$68.86M
236,Pee-wee's Big Adventure,(1985),PG,91 min,"Adventure, Comedy, Family",7.0,47        ,"When eccentric man-child Pee-wee Herman gets his beloved bike stolen in broad daylight, he sets out across the U.S. on the adventure of his life.",['Tim Burton'],"['Paul Reubens', 'Elizabeth Daily', 'Mark Holton', 'Diane Salinger']","55,013",$40.90M
237,Soul Surfer,(2011),PG,112 min,"Biography, Drama, Family",7.0,53        ,Teenage surfer Bethany Hamilton overcomes the odds and her own fears of returning to the water after losing her left arm in a shark attack.,['Sean McNamara'],"['AnnaSophia Robb', 'Dennis Quaid', 'Helen Hunt', 'Carrie Underwood']","51,198",$43.85M
238,Marley & Me,(2008),PG,115 min,"Drama, Family",7.0,53        ,"A family learns important life lessons from their adorable, but naughty and neurotic dog.",['David Frankel'],"['Owen Wilson', 'Jennifer Aniston', 'Eric Dane', 'Kathleen Turner']","162,497",$143.15M
239,Ron's Gone Wrong,(2021),PG,107 min,"Animation, Adventure, Comedy",7.0,65        ,"The story of Barney, an awkward middle-schooler and Ron, his new walking, talking, digitally-connected device. Ron's malfunctions set against the backdrop of the social media age launch them on a journey to learn about true friendship.","['Sarah Smith', 'Jean-Philippe Vine', 'Octavio E. Rodriguez']","['Jack Dylan Grazer', 'Zach Galifianakis', 'Ed Helms', 'Olivia Colman']","37,044",-
240,Bedknobs and Broomsticks,(1971),G,117 min,"Animation, Adventure, Comedy",7.0,59        ,"An apprentice witch, three kids and a cynical magician conman search for the missing component to a magic spell to be used in the defense of Britain in World War II.","['Robert Stevenson', 'Ward Kimball']","['Angela Lansbury', 'David Tomlinson', 'Roddy McDowall', 'Sam Jaffe']","39,337",$18.53M
241,An Unfinished Life,(2005),PG-13,108 min,"Drama, Family, Romance",7.0,49        ,"Desperate to provide care for her daughter, down-on-her-luck Jean moves in with her father in-law from whom she is estranged. Through time, they learn to forgive each other and heal old wounds.",['Lasse Hallström'],"['Jennifer Lopez', 'Robert Redford', 'Morgan Freeman', 'Josh Lucas']","32,203",$8.59M
242,ParaNorman,(2012),PG,92 min,"Animation, Adventure, Comedy",7.0,72        ,"A misunderstood boy takes on ghosts, zombies and grown-ups to save his town from a centuries-old curse.","['Chris Butler', 'Sam Fell']","['Kodi Smit-McPhee', 'Anna Kendrick', 'Christopher Mintz-Plasse', 'Tucker Albrizzi']","105,932",$56.00M
243,Abominable,(2019),PG,97 min,"Animation, Adventure, Comedy",7.0,61        ,Three teenagers must help a Yeti return to his family while avoiding a wealthy man and a zoologist who want him for their own needs.,"['Jill Culton', 'Todd Wilderman']","['Chloe Bennet', 'Albert Tsai', 'Tenzing Norgay Trainor', 'Joseph Izzo']","40,562",$60.72M
244,Son of Rambow,(2007),PG-13,96 min,"Action, Adventure, Comedy",7.0,66        ,"During a long English summer in the early 1980s, two schoolboys from differing backgrounds set out to make a film inspired by First Blood (1982).",['Garth Jennings'],"['Bill Milner', 'Will Poulter', 'Jessica Hynes', 'Anna Wing']","32,528",$1.78M
245,The Peanuts Movie,(2015),G,88 min,"Animation, Adventure, Comedy",7.0,67        ,"Snoopy embarks upon his greatest mission as he and his team take to the skies to pursue their archnemesis, while his best pal Charlie Brown begins his own epic quest back home to win the love of his life.",['Steve Martino'],"['Noah Schnapp', 'Bill Melendez', 'Hadley Belle Miller', 'Francesca Capaldi']","47,832",$130.18M
246,The Christmas Chronicles,(2018),PG,104 min,"Adventure, Comedy, Family",7.0,52        ,"The story of sister and brother, Kate and Teddy Pierce, whose Christmas Eve plan to catch Santa Claus on camera turns into an unexpected journey that most kids could only dream about.",['Clay Kaytis'],"['Kurt Russell', 'Darby Camp', 'Judah Lewis', 'Oliver Hudson']","77,848",-
247,My Dog Skip,(2000),PG,95 min,"Comedy, Drama, Family",7.0,61        ,"A shy boy grows up in 1940s Mississippi with the help of his beloved dog, Skip.",['Jay Russell'],"['Frankie Muniz', 'Kevin Bacon', 'Diane Lane', 'Luke Wilson']","20,956",$34.10M
248,Aladdin,(2019),PG,128 min,"Adventure, Comedy, Family",6.9,53        ,A kind-hearted street urchin and a power-hungry Grand Vizier vie for a magic lamp that has the power to make their deepest wishes come true.,['Guy Ritchie'],"['Will Smith', 'Mena Massoud', 'Naomi Scott', 'Marwan Kenzari']","276,575",$355.56M
