,title,year,certificate,time,genre,rating,metascore,simple_desc,directors,stars,votes,gross
144,Shrek 2,(2004),PG,93 min,"Animation, Adventure, Comedy",7.3,75        ,"Shrek and Fiona travel to the Kingdom of Far Far Away, where Fiona's parents are King and Queen, to celebrate their marriage. When they arrive, they find they are not as welcome as they thought they would be.","['Andrew Adamson', 'Kelly Asbury', 'Conrad Vernon']","['Mike Myers', 'Eddie Murphy', 'Cameron Diaz', 'Julie Andrews']","481,773",$436.47M
145,The NeverEnding Story,(1984),PG,102 min,"Adventure, Drama, Family",7.3,46        ,A troubled boy dives into a wondrous fantasy world through the pages of a mysterious book.,['Wolfgang Petersen'],"['Noah Hathaway', 'Barret Oliver', 'Tami Stronach', 'Gerald McRaney']","149,962",$20.16M
146,The Lego Batman Movie,(2017),PG,104 min,"Animation, Action, Adventure",7.3,75        ,"A cooler-than-ever Bruce Wayne must deal with the usual suspects as they plan to rule Gotham City, while discovering that he has accidentally adopted a teenage orphan who wishes to become his sidekick.",['Chris McKay'],"['Will Arnett', 'Michael Cera', 'Rosario Dawson', 'Ralph Fiennes']","160,507",$175.75M
147,Tarzan,(1999),G,88 min,"Animation, Adventure, Comedy",7.3,79        ,A man raised by gorillas must decide where he really belongs when he discovers he is a human.,"['Chris Buck', 'Kevin Lima']","['Tony Goldwyn', 'Minnie Driver', 'Brian Blessed', 'Glenn Close']","235,415",$171.09M
148,Finding Dory,(2016),PG,97 min,"Animation, Adventure, Comedy",7.3,77        ,Friendly but forgetful blue tang Dory begins a search for her long-lost parents and everyone learns a few things about the real meaning of family along the way.,"['Andrew Stanton', 'Angus MacLane']","['Ellen DeGeneres', 'Albert Brooks', ""Ed O'Neill"", 'Kaitlin Olson']","287,248",$486.30M
149,Megamind,(2010),PG,95 min,"Animation, Action, Comedy",7.3,63        ,"Evil genius Megamind finally defeats his do-gooder nemesis, Metro Man, but is left without a purpose in a superhero-free world.",['Tom McGrath'],"['Will Ferrell', 'Jonah Hill', 'Brad Pitt', 'Tina Fey']","276,576",$148.42M
150,The Bad News Bears,(1976),PG,102 min,"Comedy, Drama, Family",7.3,84        ,"An aging, down-on-his-luck ex-minor leaguer coaches a team of misfits in an ultra-competitive California little league.",['Michael Ritchie'],"['Walter Matthau', ""Tatum O'Neal"", 'Vic Morrow', 'Joyce Van Patten']","23,863",$42.35M
151,The Adventures of Tintin,(2011),PG,107 min,"Animation, Action, Adventure",7.3,68        ,Intrepid reporter Tintin and Captain Haddock set off on a treasure hunt for a sunken ship commanded by Haddock's ancestor.,['Steven Spielberg'],"['Jamie Bell', 'Andy Serkis', 'Daniel Craig', 'Simon Pegg']","236,775",$77.59M
152,Peter Pan,(1953),G,77 min,"Animation, Adventure, Family",7.3,76        ,"Wendy and her brothers are whisked away to the magical world of Neverland with the hero of their stories, Peter Pan.","['Clyde Geronimi', 'Wilfred Jackson', 'Hamilton Luske', 'Jack Kinney']","['Bobby Driscoll', 'Kathryn Beaumont', 'Hans Conried', 'Bill Thompson']","146,513",$87.40M
153,Despicable Me 2,(2013),PG,98 min,"Animation, Adventure, Comedy",7.3,62        ,"When Gru, the world's most super-bad turned super-dad has been recruited by a team of officials to stop lethal muscle and a host of Gru's own, He has to fight back with new gadgetry, cars, and more minion madness.","['Pierre Coffin', 'Chris Renaud']","['Steve Carell', 'Kristen Wiig', 'Benjamin Bratt', 'Miranda Cosgrove']","410,761",$368.06M
154,Cinderella,(1950),G,74 min,"Animation, Family, Fantasy",7.3,85        ,"When Cinderella's cruel stepmother prevents her from attending the Royal Ball, she gets some unexpected help from the lovable mice Gus and Jaq and from her Fairy Godmother.","['Clyde Geronimi', 'Wilfred Jackson', 'Hamilton Luske']","['Ilene Woods', 'James MacDonald', 'Eleanor Audley', 'Verna Felton']","166,647",$85.00M
155,Little Women,(1994),PG,115 min,"Drama, Family, Romance",7.3,87        ,The March sisters live and grow in post-Civil War America.,['Gillian Armstrong'],"['Susan Sarandon', 'Winona Ryder', 'Kirsten Dunst', 'Claire Danes']","61,073",$50.08M
156,Paddington,(2014),PG,95 min,"Adventure, Comedy, Family",7.3,77        ,"A young Peruvian bear travels to London in search of a home. Finding himself lost and alone at Paddington Station, he meets the kindly Brown family, who offer him a temporary haven.",['Paul King'],"['Hugh Bonneville', 'Sally Hawkins', 'Julie Walters', 'Jim Broadbent']","123,818",$76.27M
157,Corpse Bride,(2005),PG,77 min,"Animation, Drama, Family",7.3,83        ,"When a shy groom practices his wedding vows in the inadvertent presence of a deceased young woman, she rises from the grave assuming he has married her.","['Tim Burton', 'Mike Johnson']","['Johnny Depp', 'Helena Bonham Carter', 'Emily Watson', 'Tracey Ullman']","284,253",$53.36M
158,The Last Unicorn,(1982),G,92 min,"Animation, Adventure, Drama",7.3,70        ,A beautiful unicorn sets out to learn if she truly is the last of her kind in this sparkling animated musical.,"['Jules Bass', 'Arthur Rankin Jr.']","['Jeff Bridges', 'Mia Farrow', 'Angela Lansbury', 'Alan Arkin']","28,106",$6.46M
159,The Secret Garden,(1993),G,101 min,"Drama, Family, Fantasy",7.3,74        ,"A young, recently-orphaned girl is sent to England after living in India all of her life. Once there, she begins to explore her new, seemingly-isolated surroundings, and its secrets.",['Agnieszka Holland'],"['Kate Maberly', 'Maggie Smith', 'Heydon Prowse', 'Andrew Knott']","42,833",$31.18M
160,Lady and the Tramp,(1955),G,76 min,"Animation, Adventure, Comedy",7.3,78        ,The romantic tale of a sheltered uptown Cocker Spaniel dog and a streetwise downtown Mutt.,"['Clyde Geronimi', 'Wilfred Jackson', 'Hamilton Luske', 'Jack Cutting']","['Barbara Luddy', 'Larry Roberts', 'Peggy Lee', 'Bill Thompson']","141,565",$93.60M
161,Alice in Wonderland,(1951),G,75 min,"Animation, Adventure, Comedy",7.3,68        ,Alice stumbles into the world of Wonderland. Will she get home? Not if the Queen of Hearts has her way.,"['Clyde Geronimi', 'Wilfred Jackson', 'Hamilton Luske', 'Jack Kinney']","['Kathryn Beaumont', 'Ed Wynn', 'Richard Haydn', 'Sterling Holloway']","147,356",$1.07M
162,One Hundred and One Dalmatians,(1961),G,79 min,"Animation, Adventure, Comedy",7.3,83        ,"When a litter of Dalmatian puppies are abducted by the minions of Cruella De Vil, the owners must find them before she uses them for a diabolical fashion statement.","['Clyde Geronimi', 'Hamilton Luske', 'Wolfgang Reitherman']","['Rod Taylor', 'Betty Lou Gerson', ""J. Pat O'Malley"", 'Martha Wentworth']","174,274",$144.88M
163,My Sister's Keeper,(2009),PG-13,109 min,"Drama, Family",7.3,51        ,Anna Fitzgerald looks to earn medical emancipation from her parents who until now have relied on their youngest child to help their leukemia-stricken daughter Kate remain alive.,['Nick Cassavetes'],"['Cameron Diaz', 'Abigail Breslin', 'Alec Baldwin', 'Walter Raney']","95,616",$49.20M
164,Eight Below,(2006),PG,120 min,"Adventure, Drama, Family",7.3,64        ,Brutal cold forces two Antarctic explorers to leave their team of sled dogs behind as they fend for their survival.,['Frank Marshall'],"['Paul Walker', 'Jason Biggs', 'Bruce Greenwood', 'Moon Bloodgood']","66,555",$81.61M
165,Jason and the Argonauts,(1963),G,104 min,"Action, Adventure, Family",7.3,69        ,The legendary Greek hero leads a team of intrepid adventurers in a perilous quest for the legendary Golden Fleece.,['Don Chaffey'],"['Todd Armstrong', 'Nancy Kovack', 'Gary Raymond', 'Laurence Naismith']","29,505",$4.58M
166,Bambi,(1942),G,69 min,"Animation, Adventure, Drama",7.3,91        ,The story of a young deer growing up in the forest.,"['James Algar', 'Samuel Armstrong', 'David Hand', 'Graham Heid', 'Bill Roberts', 'Paul Satterfield', 'Norman Wright', 'Arthur Davis', 'Clyde Geronimi']","['Hardie Albright', 'Stan Alexander', 'Bobette Audrey', 'Peter Behn']","148,088",$102.80M
167,The Brave Little Toaster,(1987),G,90 min,"Animation, Adventure, Family",7.3,-,A group of dated appliances embark on a journey to the city to find their master after being abandoned in a cabin in the woods.,['Jerry Rees'],"['Jon Lovitz', 'Timothy Stack', 'Timothy E. Day', 'Thurl Ravenscroft']","26,831",-
168,A Street Cat Named Bob,(2016),Not Rated,103 min,"Biography, Drama, Family",7.3,54        ,"The true feel-good story of how James Bowen, a busker and recovering drug addict, has his life transformed when he meets a stray ginger cat. Based on the international best selling book.",['Roger Spottiswoode'],"['Luke Treadaway', 'Bob the Cat', 'Ruta Gedmintas', 'Joanne Froggatt']","32,530",$0.04M
169,Pom Poko,(1994),PG,119 min,"Animation, Comedy, Drama",7.3,77        ,A community of magical shape-shifting raccoon dogs struggle to prevent their forest home from being destroyed by urban development.,['Isao Takahata'],"['Shinchô Kokontei', 'Makoto Nonomura', 'Yuriko Ishida', 'Norihei Miki']","31,950",-
170,Shaun the Sheep Movie,(2015),PG,85 min,"Animation, Adventure, Comedy",7.3,81        ,"When Shaun decides to take the day off and have some fun, he gets a little more action than he bargained for. A mix up with the Farmer, a caravan and a very steep hill lead them all to the Big City and it's up to Shaun and the flock to return everyone safely to the green grass of home.","['Mark Burton', 'Richard Starzak']","['Justin Fletcher', 'John Sparkes', 'Omid Djalili', 'Richard Webber']","42,010",$19.38M
171,The Little Mermaid,(I) (2023),PG,135 min,"Adventure, Family, Fantasy",7.2,59        ,A young mermaid makes a deal with a sea witch to trade her beautiful voice for human legs so she can discover the world above water and impress a prince.,['Rob Marshall'],"['Halle Bailey', 'Jonah Hauer-King', 'Melissa McCarthy', 'Javier Bardem']","71,457",-
172,The Super Mario Bros. Movie,(2023),PG,92 min,"Animation, Adventure, Comedy",7.2,46        ,"A plumber named Mario travels through an underground labyrinth with his brother, Luigi, trying to save a captured princess.","['Aaron Horvath', 'Michael Jelenic', 'Pierre Leduc', 'Fabien Polack']","['Chris Pratt', 'Anya Taylor-Joy', 'Charlie Day', 'Jack Black']","135,860",-
173,Cars,(2006),G,117 min,"Animation, Adventure, Comedy",7.2,73        ,"On the way to the biggest race of his life, a hotshot rookie race car gets stranded in a rundown town and learns that winning isn't everything in life.","['John Lasseter', 'Joe Ranft']","['Owen Wilson', 'Bonnie Hunt', 'Paul Newman', 'Larry the Cable Guy']","439,678",$244.08M
174,Encanto,(2021),PG,102 min,"Animation, Comedy, Family",7.2,75        ,A Colombian teenage girl has to face the frustration of being the only member of her family without magical powers.,"['Jared Bush', 'Byron Howard', 'Charise Castro Smith']","['Stephanie Beatriz', 'María Cecilia Botero', 'John Leguizamo', 'Mauro Castillo']","237,185",$96.09M
175,Fantastic Beasts and Where to Find Them,(2016),PG-13,132 min,"Adventure, Family, Fantasy",7.2,66        ,The adventures of writer Newt Scamander in New York's secret community of witches and wizards seventy years before Harry Potter reads his book in school.,['David Yates'],"['Eddie Redmayne', 'Katherine Waterston', 'Alison Sudol', 'Dan Fogler']","488,806",$234.04M
176,A Bug's Life,(1998),G,95 min,"Animation, Adventure, Comedy",7.2,77        ,"A misfit ant, looking for ""warriors"" to save his colony from greedy grasshoppers, recruits a group of bugs that turn out to be an inept circus troupe.","['John Lasseter', 'Andrew Stanton']","['Kevin Spacey', 'David Foley', 'Julia Louis-Dreyfus', 'Hayden Panettiere']","301,992",$162.80M
177,Rango,(2011),PG,107 min,"Animation, Action, Adventure",7.2,75        ,"Rango is an ordinary chameleon who accidentally winds up in the town of Dirt, a lawless outpost in the Wild West in desperate need of a new sheriff.",['Gore Verbinski'],"['Johnny Depp', 'Isla Fisher', 'Timothy Olyphant', 'Abigail Breslin']","278,619",$123.48M
178,Bridge to Terabithia,(2007),PG,96 min,"Drama, Family, Fantasy",7.2,74        ,A preteen's life turns upside down when he befriends the new girl in school and they imagine a whole new fantasy world to escape reality.,['Gabor Csupo'],"['Josh Hutcherson', 'AnnaSophia Robb', 'Zooey Deschanel', 'Robert Patrick']","164,409",$82.27M
179,Treasure Planet,(2002),PG,95 min,"Animation, Adventure, Family",7.2,60        ,"In this science fiction rendering of the classic novel ""Treasure Island"", Jim Hawkins (Joseph Gordon-Levitt) is a rebellious teen seen by the world as an aimless slacker. After he receives ...                See full summary »","['Ron Clements', 'John Musker']","['Joseph Gordon-Levitt', 'Emma Thompson', 'Martin Short', 'Roscoe Lee Browne']","125,227",$38.18M
180,The Croods,(2013),PG,98 min,"Animation, Action, Adventure",7.2,55        ,"After their cave is destroyed, a caveman family must trek through an unfamiliar fantastical world with the help of an inventive boy.","['Kirk DeMicco', 'Chris Sanders']","['Nicolas Cage', 'Ryan Reynolds', 'Emma Stone', 'Catherine Keener']","222,927",$187.17M
181,The Prince of Egypt,(1998),PG,99 min,"Animation, Adventure, Drama",7.2,64        ,Egyptian Prince Moses learns of his identity as a Hebrew and his destiny to become the chosen deliverer of his people.,"['Brenda Chapman', 'Steve Hickner', 'Simon Wells']","['Val Kilmer', 'Ralph Fiennes', 'Michelle Pfeiffer', 'Sandra Bullock']","138,663",$101.22M
182,Monsters University,(2013),G,104 min,"Animation, Adventure, Comedy",7.2,65        ,"A look at the relationship between Mike Wazowski (Billy Crystal) and James P. ""Sully"" Sullivan (John Goodman) during their days at Monsters University, when they weren't necessarily the best of friends.",['Dan Scanlon'],"['Billy Crystal', 'John Goodman', 'Steve Buscemi', 'Helen Mirren']","371,798",$268.49M
183,The Parent Trap,(1961),Passed,129 min,"Comedy, Family, Romance",7.2,73        ,Teenage twin sisters swap places and scheme to reunite their divorced parents.,['David Swift'],"['Hayley Mills', ""Maureen O'Hara"", 'Brian Keith', 'Charles Ruggles']","22,756",-
184,Kung Fu Panda 2,(2011),PG,90 min,"Animation, Action, Adventure",7.2,67        ,"Po and his friends fight to stop a peacock villain from conquering China with a deadly new weapon, but first the Dragon Warrior must come to terms with his past.",['Jennifer Yuh Nelson'],"['Jack Black', 'Angelina Jolie', 'Jackie Chan', 'Dustin Hoffman']","298,992",$165.25M
185,Sleeping Beauty,(1959),G,75 min,"Animation, Adventure, Family",7.2,85        ,"After being snubbed by the royal family, a malevolent fairy places a curse on a princess which only a prince can break, along with the help of three good fairies.","['Les Clark', 'Clyde Geronimi', 'Eric Larson', 'Wolfgang Reitherman', 'Hamilton Luske']","['Mary Costa', 'Bill Shirley', 'Eleanor Audley', 'Verna Felton']","154,360",$51.60M
186,The Book of Life,(2014),PG,95 min,"Animation, Adventure, Comedy",7.2,67        ,"Manolo, a young man who is torn between fulfilling the expectations of his family and following his heart, embarks on an adventure that spans three fantastic worlds where he must face his greatest fears.",['Jorge R. Gutiérrez'],"['Diego Luna', 'Zoe Saldana', 'Channing Tatum', 'Ron Perlman']","74,229",$50.15M
187,Spirit: Stallion of the Cimarron,(2002),G,83 min,"Animation, Adventure, Drama",7.2,52        ,"A wild stallion is captured by humans and slowly loses the will to resist training, yet, throughout his struggles for freedom, the stallion refuses to let go of the hope of one day returning home to his herd.","['Kelly Asbury', 'Lorna Cook']","['Matt Damon', 'James Cromwell', 'Daniel Studi', 'Chopper Bernet']","80,555",$73.28M
188,Rise of the Guardians,(2012),PG,97 min,"Animation, Action, Adventure",7.2,58        ,"When the evil spirit Pitch launches an assault on Earth, the Immortal Guardians team up to protect the innocence of children all around the world.",['Peter Ramsey'],"['Hugh Jackman', 'Alec Baldwin', 'Isla Fisher', 'Chris Pine']","183,611",$103.41M
189,Christopher Robin,(2018),PG,104 min,"Adventure, Comedy, Drama",7.2,60        ,"A working-class family man, Christopher Robin, encounters his childhood friend Winnie-the-Pooh, who helps him to rediscover the joys of life.",['Marc Forster'],"['Ewan McGregor', 'Hayley Atwell', 'Bronte Carmichael', 'Mark Gatiss']","80,989",$99.22M
190,Wish Dragon,(2021),PG,98 min,"Animation, Adventure, Comedy",7.2,59        ,Determined teen Din is longing to reconnect with his childhood best friend when he meets a wish-granting dragon who shows him the magic of possibilities.,['Chris Appelhans'],"['Jimmy Wong', 'John Cho', 'Constance Wu', 'Natasha Liu Bordizzo']","29,922",-
191,A Dog's Purpose,(2017),PG,100 min,"Adventure, Comedy, Drama",7.2,43        ,A dog looks to discover his purpose in life over the course of several lifetimes and owners.,['Lasse Hallström'],"['Josh Gad', 'Dennis Quaid', 'Peggy Lipton', 'Bryce Gheisar']","75,514",$64.51M
192,The Fox and the Hound,(1981),G,83 min,"Animation, Adventure, Drama",7.2,65        ,"A fox named Tod and a hound named Copper vow to be best friends forever. But as Copper grows into a hunting dog, their unlikely friendship faces the ultimate test.","['Ted Berman', 'Richard Rich', 'Art Stevens', 'David Hand', 'Wolfgang Reitherman']","['Mickey Rooney', 'Kurt Russell', 'Pearl Bailey', 'Jack Albertson']","97,285",$63.46M
193,The Transformers: The Movie,(1986),PG,84 min,"Animation, Action, Adventure",7.2,43        ,"The Autobots must stop a colossal planet consuming robot who goes after the Autobot Matrix of Leadership. At the same time, they must defend themselves against an all-out attack from the Decepticons.",['Nelson Shin'],"['Orson Welles', 'Robert Stack', 'Leonard Nimoy', 'Norman Alden']","40,765",$5.85M
194,"20,000 Leagues Under the Sea",(1954),G,127 min,"Adventure, Drama, Family",7.2,83        ,"A ship sent to investigate a wave of mysterious sinkings encounters the advanced submarine, the Nautilus, commanded by Captain Nemo.",['Richard Fleischer'],"['Kirk Douglas', 'James Mason', 'Paul Lukas', 'Peter Lorre']","35,496",$28.20M
195,Dumbo,(1941),G,64 min,"Animation, Adventure, Drama",7.2,96        ,"Ridiculed because of his enormous ears, a young circus elephant is assisted by a mouse to achieve his full potential.","['Samuel Armstrong', 'Norman Ferguson', 'Wilfred Jackson', 'Jack Kinney', 'Bill Roberts', 'Ben Sharpsteen', 'John Elliotte']","['Sterling Holloway', 'Edward Brophy', 'Herman Bing', 'Mel Blanc']","136,633",$1.60M
196,Secretariat,(2010),PG,123 min,"Biography, Drama, Family",7.2,61        ,"Penny Chenery Tweedy and colleagues guide her long-shot but precocious stallion to set, in 1973, the unbeaten record for winning the Triple Crown.",['Randall Wallace'],"['Diane Lane', 'John Malkovich', 'Margo Martindale', 'Nelsan Ellis']","29,580",$59.71M
197,Stan & Ollie,(2018),PG,98 min,"Biography, Comedy, Drama",7.2,75        ,"Laurel and Hardy, the world's most famous comedy duo, attempt to reignite their film careers as they embark on what becomes their swan song: a grueling theatre tour of post-war Britain.",['Jon S. Baird'],"['Steve Coogan', 'John C. Reilly', 'Shirley Henderson', 'Nina Arianda']","38,750",$5.47M
198,"Dragon Ball Z: Resurrection ""F""",(2015),Not Rated,93 min,"Animation, Action, Adventure",7.2,-,"One peaceful day on Earth, two remnants of Freeza's army named Sorube and Tagoma arrive searching for the Dragon Balls with the aim of reviving Freeza. They succeed, and Freeza subsequently seeks revenge on the Saiya-jin.",['Tadayoshi Yamamuro'],"['Masako Nozawa', 'Ryô Horikawa', 'Hiromi Tsuru', 'Masaharu Satô']","23,112",$8.01M
199,Beauty and the Beast,(I) (2017),PG,129 min,"Adventure, Family, Fantasy",7.1,65        ,"A selfish Prince is cursed to become a monster for the rest of his life, unless he learns to fall in love with a beautiful young woman he keeps prisoner.",['Bill Condon'],"['Emma Watson', 'Dan Stevens', 'Luke Evans', 'Josh Gad']","319,815",$504.01M
200,Roald Dahl's Matilda the Musical,(2022),PG,117 min,"Comedy, Drama, Family",7.1,72        ,"An adaptation of the Tony and Olivier award-winning musical. Matilda tells the story of an extraordinary girl who, armed with a sharp mind and a vivid imagination, dares to take a stand to change her story with miraculous results.",['Matthew Warchus'],"['Alisha Weir', 'Emma Thompson', 'Lashana Lynch', 'Stephen Graham']","23,128",-
201,Sing,(2016),PG,108 min,"Animation, Comedy, Family",7.1,59        ,"In a city of humanoid animals, a hustling theater impresario's attempt to save his theater with a singing competition becomes grander than he anticipates even as its finalists find that their lives will never be the same.","['Garth Jennings', 'Christophe Lourdelet']","['Matthew McConaughey', 'Reese Witherspoon', 'Seth MacFarlane', 'Scarlett Johansson']","178,867",$270.40M
202,DC League of Super-Pets,(2022),PG,105 min,"Animation, Action, Adventure",7.1,56        ,"Krypto the Super-Dog and Superman are inseparable best friends, sharing the same superpowers and fighting crime side by side in Metropolis. However, Krypto must master his own powers for a rescue mission when Superman is kidnapped.","['Jared Stern', 'Sam J. Levine']","['Dwayne Johnson', 'Kevin Hart', 'Kate McKinnon', 'John Krasinski']","69,560",$93.66M
203,The Princess and the Frog,(2009),G,97 min,"Animation, Adventure, Comedy",7.1,73        ,"A waitress, desperate to fulfill her dreams as a restaurant owner, is set on a journey to turn a frog prince back into a human being, but she has to face the same problem after she kisses him.","['Ron Clements', 'John Musker']","['Anika Noni Rose', 'Keith David', 'Oprah Winfrey', 'Bruno Campos']","154,513",$104.40M
204,Enchanted,(2007),PG,107 min,"Animation, Adventure, Comedy",7.1,75        ,"A young maiden in a land called Andalasia, who is prepared to be wed, is sent away to New York City by an evil Queen, where she falls in love with a lawyer.",['Kevin Lima'],"['Amy Adams', 'Susan Sarandon', 'James Marsden', 'Patrick Dempsey']","210,575",$127.81M
205,Anastasia,(1997),G,94 min,"Animation, Adventure, Drama",7.1,61        ,"The last surviving child of the Russian Royal Family joins two con men to reunite with her grandmother, the Dowager Empress, while the undead Rasputin seeks her death.","['Don Bluth', 'Gary Goldman']","['Meg Ryan', 'John Cusack', 'Christopher Lloyd', 'Kelsey Grammer']","129,482",$58.41M
206,Chicken Run,(2000),G,84 min,"Animation, Adventure, Comedy",7.1,88        ,"When a cockerel apparently flies into a chicken farm, the chickens see him as an opportunity to escape their evil owners.","['Peter Lord', 'Nick Park']","['Mel Gibson', 'Julia Sawalha', 'Phil Daniels', 'Lynn Ferguson']","199,358",$106.83M
207,Brave,(2012),PG,93 min,"Animation, Adventure, Comedy",7.1,69        ,"Determined to make her own path in life, Princess Merida defies a custom that brings chaos to her kingdom. Granted one wish, Merida must rely on her bravery and her archery skills to undo a beastly curse.","['Mark Andrews', 'Brenda Chapman', 'Steve Purcell']","['Kelly Macdonald', 'Billy Connolly', 'Emma Thompson', 'Julie Walters']","424,067",$237.28M
208,We Bought a Zoo,(2011),PG,124 min,"Comedy, Drama, Family",7.1,58        ,"Set in Southern California, a father moves his young family to the countryside to renovate and re-open a struggling zoo.",['Cameron Crowe'],"['Matt Damon', 'Scarlett Johansson', 'Thomas Haden Church', 'Elle Fanning']","147,312",$75.62M
209,Kung Fu Panda 3,(2016),PG,95 min,"Animation, Action, Adventure",7.1,66        ,"Continuing his ""legendary adventures of awesomeness"", Po must face two hugely epic, but different threats: one supernatural and the other a little closer to home.","['Alessandro Carloni', 'Jennifer Yuh Nelson']","['Jack Black', 'Bryan Cranston', 'Dustin Hoffman', 'Angelina Jolie']","170,389",$143.53M
210,The AristoCats,(1970),G,78 min,"Animation, Adventure, Comedy",7.1,66        ,"With the help of a smooth talking tomcat, a family of Parisian felines set to inherit a fortune from their owner try to make it back home after a jealous butler kidnaps them and leaves them in the country.",['Wolfgang Reitherman'],"['Phil Harris', 'Eva Gabor', 'Sterling Holloway', 'Scatman Crothers']","109,206",$37.68M
211,Elf,(2003),PG,97 min,"Adventure, Comedy, Family",7.1,64        ,"Raised as an oversized elf, Buddy travels from the North Pole to New York City to meet his biological father, Walter Hobbs, who doesn't know he exists and is in desperate need of some Christmas spirit.",['Jon Favreau'],"['Will Ferrell', 'James Caan', 'Bob Newhart', 'Zooey Deschanel']","286,984",$173.40M
212,The SpongeBob SquarePants Movie,(2004),PG,87 min,"Animation, Adventure, Comedy",7.1,66        ,SpongeBob SquarePants takes leave from the town of Bikini Bottom in order to track down King Neptune's stolen crown.,"['Stephen Hillenburg', 'Mark Osborne']","['Tom Kenny', 'Jeffrey Tambor', 'Rodger Bumpass', 'Carolyn Lawrence']","96,343",$85.42M
213,Miracles from Heaven,(2016),PG,109 min,"Biography, Drama, Family",7.1,44        ,Based on the incredible true story of the Beam family.,['Patricia Riggen'],"['Jennifer Garner', 'Kylie Rogers', 'Martin Henderson', 'Brighton Sharbino']","26,995",$61.71M
214,The Muppets,(2011),PG,103 min,"Adventure, Comedy, Family",7.1,75        ,A Muppet fanatic with some help from his 2 human compatriots must regroup the Muppet gang to stop an avaricious oil mogul from taking down one of their precious life-longing treasures.,['James Bobin'],"['Amy Adams', 'Jason Segel', 'Chris Cooper', 'Rashida Jones']","94,704",$88.63M
